id,stages,case,conditions,image,text,marker,silent,targeted stage
twilight,0-9,female_removed_accessory,"target=monika,targetStage=1",what,"Oh, wait, is that not supposed to happen? I thought clothing disappearing was just a thing that happened on this world...",,False,1
twilight,0-9,female_removed_accessory,"target=monika,targetStage=3",what,Wait a second. Was it just me or was Monika using more just a few moments ago? Oh right! She took off her stockings last time.,,False,3
twilight,0-7,good_hand,"notSaidMarker=twilight_monika_wtip,alsoPlayingSaidMarker=writing_tip,alsoPlaying=monika",smart,That is a handy tip. I'll keep it in mind for when I write my report to Celestia!,twilight_monika_wtip,False,
twilight,0-7,okay_hand,"notSaidMarker=twilight_monika_wtip,alsoPlayingSaidMarker=writing_tip,alsoPlaying=monika",smart,That is a handy tip. I'll keep it in mind for when I write my report to Celestia!,twilight_monika_wtip,False,
twilight,0-7,bad_hand,"notSaidMarker=twilight_monika_wtip,alsoPlayingSaidMarker=writing_tip,alsoPlaying=monika",smart,That is a handy tip. I'll keep it in mind for when I write my report to Celestia!,twilight_monika_wtip,False,
,,,,,,,,
kyu,7,masturbating,"alsoPlayingSaidMarker=glitching-kyu,alsoPlaying=monika",masturbate-a,Wh-What's... happening to me?,glitched,False,
kyu,7,masturbating,"alsoPlayingSaidMarker=glitching-kyu,alsoPlaying=monika",masturbate-a,~player~... I don't feel so good...,glitched,False,
kyu,7,finishing_masturbating,"saidMarker=glitched,alsoPlaying=monika",repulsed,"Okay- No, this feels way too weird. I think I'm gonna hurl.",,False,
kyu,7,heavy_masturbating,"alsoPlayingSaidMarker=glitching-kyu,alsoPlaying=monika",masturbate-a,Wh-What's... happening to me?,glitched,False,
kyu,7,heavy_masturbating,"alsoPlayingSaidMarker=glitching-kyu,alsoPlaying=monika",masturbate-a,~player~... I don't feel so good...,glitched,False,
kyu,0,good_hand,"timeInStage=0,alsoPlaying=monika",neutral,"~player~, I don't feel so good...",,False,
kyu,0,okay_hand,"timeInStage=0,alsoPlaying=monika",neutral,"~player~, I don't feel so good...",,False,
kyu,0,bad_hand,"timeInStage=0,alsoPlaying=monika",neutral,"~player~, I don't feel so good...",,False,
kyu,8,female_must_strip,"saidMarker=glitched,notSaidMarker=vomited,alsoPlaying=monika",repulsed,Ick. Gross.,vomited,False,
kyu,8,female_must_strip,"saidMarker=glitched,notSaidMarker=vomited,target=monika",repulsed,Ick. Gross.,vomited,False,
kyu,8,female_human_must_strip,"saidMarker=glitched,notSaidMarker=vomited,alsoPlaying=monika",repulsed,Ick. Gross.,vomited,False,
kyu,8,male_must_strip,"saidMarker=glitched,notSaidMarker=vomited,alsoPlaying=monika",repulsed,Ick. Gross.,vomited,False,
kyu,8,male_human_must_strip,"saidMarker=glitched,notSaidMarker=vomited,alsoPlaying=monika",repulsed,Ick. Gross.,vomited,False,
kyu,8,finished_masturbating,"saidMarker=glitched,timeInStage=0,alsoPlaying=monika",puke,<i>Bleeeech.</i>,,False,
,,,,,,,,
chun-li,0-10,female_must_strip,"targetStage=0,target=monika,filter=9s",interested,"Monika, isn't it? You look like a schoolgirl, but you give off a more mature feeling. I wouldn't be surprised if you're the Student Council president or something.",,False,0
chun-li,0-10,female_must_strip,"target=monika,targetStage=1",sad,"You're just a highschool girl, right? It's just that the way to seem to have everything under control is... scary.",,False,1
chun-li,0-10,female_must_strip,"target=monika,targetStage=1",sad,Are you really a highschool girl? It's a little scary how you seem to keep your cool in this situation.,,False,1
chun-li,0-10,female_removed_accessory,"target=monika,targetStage=3",shocked,"Wait, what?! What happened? I blinked and then...",,False,3
chun-li,0-10,female_removed_accessory,"target=monika,targetStage=3",shocked,Eh? Did I miss something? What's going on here?,,False,3
chun-li,0-10,female_removed_accessory,"targetStage=6,target=monika",annoyed,Not to mention that counting your ribbons as clothing is pushing it. You should've followed my example.,,False,6
chun-li,0-10,female_removed_accessory,"targetStage=6,target=monika",annoyed,And why would you even count your ribbons as clothing? I didn't.,,False,6
chun-li,0-10,female_removing_accessory,"targetStage=2,target=monika",calm,What are you gonna do? Just take off your blazer.,,False,2
chun-li,0-10,female_removing_accessory,"targetStage=2,target=monika",calm,"You're just gonna take off your blazer, what else can you possibly do?",,False,2
chun-li,0-10,female_removing_accessory,"target=monika,targetStage=5",annoyed,"Are kidding me, Monika? You had to wait until you were on your underwear to take off your ribbons?",,False,5
chun-li,0-10,female_removing_accessory,"target=monika,targetStage=5",annoyed,Why did you have to wait until you were on your underwear to take off your ribbons? This isn't fair.,,False,5
,,,,,,,,
juri,0-6,female_must_strip,"target=monika,targetStage=0",disappointed,This chick gives me a bad vibe...,,False,0
juri,0-6,female_must_strip,"target=monika,targetStage=0",disappointed,"Not sure why, but I have a bad feeling about this girl.",,False,0
juri,0-6,female_must_strip,"target=monika,targetStage=1",calm,"There's more to you than meets the eye, isn't there, schoolgirl? For better or worse...",,False,1
juri,0-6,female_must_strip,"target=monika,targetStage=1",calm,"Who are you really, schoolgirl? Or <i>what</i> are you?",,False,1
juri,0-6,female_removed_accessory,"target=monika,targetStage=3",shocked,What the...?! What was that? I don't like this...,,False,3
juri,0-6,female_removed_accessory,"target=monika,targetStage=3",shocked,What the fuck was that?! Is this real?,,False,3
juri,0-6,female_removed_accessory,"targetStage=6,target=monika",disappointed,Goddammit. A mere schoolgirl...,,False,6
juri,0-6,female_removed_accessory,"targetStage=6,target=monika",disappointed,"Hmph, I'll forgive you this time.",,False,6
juri,0-6,female_removing_accessory,"targetStage=2,target=monika",disappointed,That plain looking blazer is your choice. How could this be any fun?,,False,2
juri,0-6,female_removing_accessory,"targetStage=2,target=monika",disappointed,Your ugly blazer? Boooring...,,False,2
juri,0-6,female_removing_accessory,"target=monika,targetStage=5",angry,Now?! When we are so fucking close to what matters the most?! You little...,,False,5
juri,0-6,female_removing_accessory,"target=monika,targetStage=5",angry,"Oh, you damned chick! I should just...",,False,5
,,,,,,,,
joey,0-2,female_removed_accessory,"target=monika,targetStage=3",laugh,"Haha! ""Delete."" That's a funny thing to call your trick!",,False,3
joey,0-2,female_removing_accessory,"targetStage=2,target=monika",happy,"Oh? Do you know magic too, Monika?",,False,2
joey,3-8,female_removed_accessory,"target=monika,targetStage=3",laugh,"Just kidding! I'm not mad! In fact, I'm glad to know I'm not the only one who can't get that trick down!",,False,3
joey,3-8,female_removing_accessory,"targetStage=2,target=monika",cross,"<i>Oh, you're gonna copy my trick, huh?</i>",,False,2
,,,,,,,,
chiaki,0-10,female_must_strip,"target=monika,targetStage=0",sleepy,(What's this... strange feeling I'm getting from Monika?),,False,0
chiaki,0-10,female_must_strip,"target=monika,targetStage=1",thinking,"So... Monika. That's a school uniform, isn't it? What school do you go to?",,False,1
chiaki,0-10,female_removing_minor,"target=monika,targetStage=1",happy,Do you like your classmates? I think you mentioned something about a literature club?,,False,1
chiaki,0-10,female_removed_accessory,"target=monika,targetStage=1",sleepy,(Maybe... I should keep an eye on her. But that doesn't mean I can't try to be friendly...),,False,1
chiaki,0-10,female_removed_accessory,"target=monika,targetStage=3",thinking,(Yeah. Something is definitely wrong here.),,False,3
chiaki,0-10,female_removing_accessory,"target=monika,targetStage=0",sad,(This is the same pressure I felt around Kamakura... and <i>her</i>...,,False,0
chiaki,0-10,female_removed_minor,"targetStage=2,target=monika",excited,Maybe I should start a gaming club at Hope's Peak!,,False,2
chiaki,0-8,good_hand,"notSaidMarker=glitchesandbugs,alsoPlayingSaidMarker=glitch-type-corrupt,alsoPlaying=monika",thinking,Hm... something seems... odd here...,glitchesandbugs,False,
chiaki,0-8,good_hand,"notSaidMarker=glitchesandbugs,alsoPlaying=monika,alsoPlayingSaidMarker=glitch-type-delete",thinking,Hm... something seems... odd here...,glitchesandbugs,False,
chiaki,0-8,good_hand,"notSaidMarker=glitchesandbugs,alsoPlayingSaidMarker=glitch-type-edit,alsoPlaying=monika",thinking,Hm... something seems... odd here...,glitchesandbugs,False,
chiaki,0-8,good_hand,"notSaidMarker=glitchesandbugs,alsoPlayingSaidMarker=glitch-type-visual,alsoPlaying=monika",thinking,Hm... something seems... odd here...,glitchesandbugs,False,
chiaki,0-8,okay_hand,"notSaidMarker=glitchesandbugs,alsoPlayingSaidMarker=glitch-type-corrupt,alsoPlaying=monika",thinking,Hm... something seems... odd here...,glitchesandbugs,False,
chiaki,0-8,okay_hand,"notSaidMarker=glitchesandbugs,alsoPlaying=monika,alsoPlayingSaidMarker=glitch-type-delete",thinking,Hm... something seems... odd here...,glitchesandbugs,False,
chiaki,0-8,okay_hand,"notSaidMarker=glitchesandbugs,alsoPlayingSaidMarker=glitch-type-edit,alsoPlaying=monika",thinking,Hm... something seems... odd here...,glitchesandbugs,False,
chiaki,0-8,okay_hand,"notSaidMarker=glitchesandbugs,alsoPlayingSaidMarker=glitch-type-visual,alsoPlaying=monika",thinking,Hm... something seems... odd here...,glitchesandbugs,False,
chiaki,0-8,bad_hand,"notSaidMarker=glitchesandbugs,alsoPlayingSaidMarker=glitch-type-corrupt,alsoPlaying=monika",thinking,Hm... something seems... odd here...,glitchesandbugs,False,
chiaki,0-8,bad_hand,"notSaidMarker=glitchesandbugs,alsoPlayingSaidMarker=glitch-type-delete,alsoPlaying=monika",thinking,Hm... something seems... odd here...,glitchesandbugs,False,
chiaki,0-8,bad_hand,"notSaidMarker=glitchesandbugs,alsoPlayingSaidMarker=glitch-type-edit,alsoPlaying=monika",thinking,Hm... something seems... odd here...,glitchesandbugs,False,
chiaki,0-8,bad_hand,"notSaidMarker=glitchesandbugs,alsoPlayingSaidMarker=glitch-type-visual,alsoPlaying=monika",thinking,Hm... something seems... odd here...,glitchesandbugs,False,
,,,,,,,,
mahiru,0-9,female_finished_masturbating,target=monika,sad,"Not again! For some reason, my camera keeps glitching when I try to photograph Monika...",,False,10
mahiru,0-7,female_must_strip,"target=monika,targetStage=0",thinking,You're staring at ~player~ an awful lot. Are you two friends by any chance?,,False,0
mahiru,0-7,female_removing_minor,"target=monika,targetStage=1",excited,Stockings are a good choice.,,False,1
mahiru,0-7,female_removed_major,"target=monika,targetStage=4",happy,"Okay, back in the swing of things. Next hand, please.",,False,4
mahiru,0-7,female_removed_major,"target=monika,targetStage=5",sad,Sorry. All I can suggest is to try a little harder.,,False,5
mahiru,0-7,female_crotch_will_be_visible,target=monika,happy,"Okay, your last piece! (Maybe I can get the shot this time!)",,False,7
mahiru,0-7,female_crotch_is_visible,target=monika,excited,"Uh, yep. There you are. And ~player~ looks... happy?",,False,8
mahiru,0-7,female_removed_accessory,"target=monika,targetStage=1",shocked,"Oh, they're a bit tight? I'm sorry to hear that.",,False,1
mahiru,0-7,female_removed_accessory,"target=monika,targetStage=3",sad,They're not in the pile... what happened?,,False,3
mahiru,0-7,female_removed_accessory,"targetStage=6,target=monika",happy,You look great! I've got to get a picture of your hair down like that!,,False,6
mahiru,0-7,female_medium_chest_is_visible,target=monika,embarrassed,"I really don't have anything to say. At least, nothing that hasn't been said already.",,False,7
mahiru,0-7,female_removing_accessory,"target=monika,targetStage=0",excited,"Nice shoes, Monika! Are they part of the uniform?",,False,0
mahiru,0-7,female_removing_accessory,"targetStage=2,target=monika",shocked,Huh? Guess I wasn't paying attention.,,False,2
mahiru,0-7,female_removing_accessory,"target=monika,targetStage=5",excited,"Ah, I'm glad you found something else to use.",,False,5
mahiru,0-7,female_removing_major,"target=monika,targetStage=3",embarrassed,I'll be sure to pay attention this time.,,False,3
mahiru,0-7,female_removing_major,"target=monika,targetStage=4",happy,"You've been fine so far, Monika! You'll do great!",,False,4
mahiru,0-7,female_chest_will_be_visible,target=monika,happy,(~player~ looks really excited to see this... maybe I should get a reaction picture.),,False,6
mahiru,0-7,female_removed_minor,"targetStage=2,target=monika",happy,I have some good frinds who'd probably agree with you there.,,False,2
,,,,,,,,
sei,0-10,female_must_strip,"target=monika,targetStage=0",annoyed,"Hey, you there. Let me see some ID.",,False,0
sei,0-10,female_must_strip,"target=natsuki,targetStage=3,alsoPlaying=monika",annoyed,Would you two barely-legal schoolgirls knock it off?,,False,
sei,0-10,female_removed_accessory,"target=monika,targetStage=1",sad,"You aren't hacking your ID information or anything, are you, Monika? I'd feel really bad if you're not supposed to be here, and it's my job to kick you out...",,False,1
sei,0-10,female_removed_accessory,"target=monika,targetStage=3",excited,"I'm not really sure what you're doing, but these are some very advanced skills, Monika. I'm not sure if the drinks are stronger than I predicted, or this is something magical!",,False,3
sei,0-10,female_removed_accessory,"targetNotSaidMarker=player_f,alsoPlaying=monika,targetStage=4,target=natsuki",excited,"The pot shots you take at each other are <i>so</i> high school. I didn't even finish high school! Besides, I bet <i>~player~'d</i> rather shoot on you both at once, than just watch you fight.",,False,
sei,0-10,female_removing_accessory,"target=monika,targetStage=0",shocked,The ID seems to check out... but there's something a bit strange...,,False,0
sei,0-10,female_removing_accessory,"targetStage=2,target=monika",shocked,W-whoa!,,False,2
sei,0-10,female_removing_accessory,"target=natsuki,targetStage=3,alsoPlaying=monika",sad,"You two are getting kind of mean with each other, and over ~player~, no less!",,False,
,,,,,,,,
weiss,0,must_strip_normal,"alsoPlayingStage=0-3,alsoPlaying=monika",embarrassed,My hair is naturally white!,,False,0-3
weiss,0,must_strip_normal,"alsoPlayingStage=0-3,alsoPlaying=monika",embarrassed,"I'm not a hundred years old!  I'm an adult, but I'm still in my 20s!",,False,0-3
,,,,,,,,
rinkah,0-8,female_must_strip,"target=monika,targetStage=1",think,"Hey, Monika. Do you and ~player~ know each other?",,False,1
rinkah,0-8,female_removing_minor,"target=monika,targetStage=1",think,You seem to be really interested in them.,,False,1
rinkah,0-8,female_removed_accessory,"target=monika,targetStage=3",shocked,The hell? Where'd your blazer go?,,False,3
rinkah,0-8,female_removing_accessory,"target=monika,alsoPlaying=9s,targetStage=0,targetSaidMarker=9s_hack1",calm,"Are you okay, 9S? Something seems to be bugging you.",,False,0
rinkah,0-6,game_over_victory,"alsoPlaying=monika,priority=105",sad,It's over... so why do I still feel so... uneasy?,,False,
,,,,,,,,
futaba,0-8,female_must_strip,"targetStage=2,target=monika",interested,Hmm... What codename should Monika have...,,False,2
futaba,0-8,female_must_strip,"target=monika,targetStage=3",happy,"About your codename... I thought about Cthulhu, because of your squid name!",,False,3
futaba,0-8,female_removing_minor,"target=monika,targetStage=1",interested,It's been years since any of the Phantom Thieves have been able to use Cognitive Psience...,,False,1
futaba,0-8,female_removed_major,"target=monika,targetStage=4",interested,"Unless you're not actually Japanese... It's okay, I don't look super Japanese either, so I figured I'd just assume you were!",,False,4
futaba,0-8,female_removed_accessory,"target=monika,targetStage=3",triumphant,"I've got it! My Persona was Necronomicon, so Monika's codename should be Nyarlathotep!",,False,3
futaba,0-8,female_removing_accessory,"targetStage=2,target=monika",awkward,I dunno... she is kind of hacking... but I can only see it in short glimpses...,,False,2
futaba,0-8,female_removing_major,"target=monika,targetStage=3",shocked,"You know, Mon-Ika? H-huh?",,False,3
futaba,0-8,female_removed_minor,"targetStage=2,target=monika",dissappointed,"But I'm not seeing a Persona for you... or a codename, for that matter...",,False,2
futaba,0-6,female_must_strip,"target=monika,targetStage=1",shocked,Monika! How did you get Metaverse access back?,,False,1
futaba,0-6,good_hand,"totalRounds=2,alsoPlaying=monika,priority=550",shocked,"Wait a second, is Monika using the Metaverse? How!?",monika_hacking,False,
futaba,0-6,good_hand,"totalRounds=2,alsoPlaying=monika,priority=550",shocked,"Whoa... Monika, how are you using the Metaverse to hack like this? <i>Very</i> cool!",monika_hacking,False,
futaba,0-6,okay_hand,"totalRounds=2,alsoPlaying=monika,priority=550",shocked,"Wait a second, is Monika using the Metaverse? How!?",monika_hacking,False,
futaba,0-6,okay_hand,"totalRounds=2,alsoPlaying=monika,priority=550",shocked,"Whoa... Monika, how are you using the Metaverse to hack like this? <i>Very</i> cool!",monika_hacking,False,
futaba,0-6,bad_hand,"totalRounds=2,alsoPlaying=monika,priority=550",shocked,"Wait a second, is Monika using the Metaverse? How!?",monika_hacking,False,
futaba,0-6,bad_hand,"totalRounds=2,alsoPlaying=monika,priority=550",shocked,"Whoa... Monika, how are you using the Metaverse to hack like this? <i>Very</i> cool!",monika_hacking,False,
,,,,,,,,
gwen,2,bad_hand,alsoPlaying=monika,sad,"Hey everyone, I don't feel so good...",,False,
gwen,8,game_over_defeat,target=monika,shocked,"Oh no, I don't feel so good...",monika_thanos,False,
,,,,,,,,
velma,"0-4,7",female_must_strip,"target=monika,targetStage=0",pensive,"I'm really getting some bad vibes from you, Monika. I might need to investigate for clues. This seems spooky to me.",,False,0
,,,,,,,,
nugi-chan,0,game_start,alsoPlaying=monika,awkward,We're playing with Little Bobbie Tables... I'm sure <i>that</i> won't go terribly.,,False,
,,,,,,,,
shimakaze,10,female_must_strip,"notSaidMarker=renglitch1,target=monika",rentalk,"... Hey, Rensouhou-chan, do you feel that too?",renglitch1,False,
shimakaze,10,female_must_strip,"notSaidMarker=renglitch1,target=monika",rentalk,"I feel kinda funny. How about you, Rensouhou-chan?",renglitch1,False,
shimakaze,0-8,female_must_strip,"targetStage=2,target=monika",ganbatte,"Oh, Monika, are you gonna take off your-",,False,2
shimakaze,0-8,female_removing_minor,"target=monika,targetStage=1",thinking,"... Monika, you say a lot of weird things, you know?",,False,1
shimakaze,0-8,female_removing_accessory,"targetStage=2,target=monika",shuffle,"..? Hey, fairies, are our radars okay?",,False,2
shimakaze,0-8,female_removed_minor,target=monika,stumped,I don't know what you're even saying sometimes!,,False,
shimakaze,0-3,female_removed_accessory,"target=monika,targetStage=3",thinking,Huh. Must've been a false reading.,,False,3
shimakaze,4-8,female_removed_accessory,"target=monika,targetStage=3",frustrated,Looks like our comms were worse that I thought. Better remember to tell Akashi about that...,,False,3
,,,,,,,,
ryuji,0,female_removed_minor,"alsoPlayingStage=3,alsoPlaying=monika",startled,What the--where the hell did that sweater thing go!?,,False,3
ryuji,0,good_hand,"totalRounds=0-2,alsoPlaying=monika",fingerguns,♫ A lil' bit of Monika in my life!~ ♫,,False,
ryuji,0,okay_hand,alsoPlaying=monika,fingerguns,♫ A lil' bit of Monika in my life!~ ♫,,False,
ryuji,0,must_strip_normal,"alsoPlayingStage=0-3,alsoPlaying=monika,tag:ddlc=1",grumpy,"Hey, that's just how I style it!",,False,0-3
ryuji,0-9,female_removing_accessory,"target=monika,targetStage=5",awkward,Your last stand?,,False,5
ryuji,0-5,female_must_strip,"target=monika,notSaidMarker=heeviejeebies,targetSaidMarker=resp-s0-must-strip-pit,priority=555",thinking,"Actually... Yeah, I do feel ya. It gives me the creeps.",heeviejeebies,False,
ryuji,"0-7,9",female_masturbating,target=monika,pumped,"Dude, DUDE! She's looking at YOU, ~player~!",,False,9
ryuji,"0-7,9",female_masturbating,target=monika,awkward,"You're really lucky, ~player~! I bet Monika's thinkin' of you.",,False,9
ryuji,"0-7,9",female_removed_accessory,"targetStage=6,target=monika",aroused,"I-I do think you look really pretty with your hair down, though...",,False,6
ryuji,8,female_removed_accessory,"targetStage=6,target=monika",neutral,Y-You look really pretty with your hair like that.,,False,6
ryuji,8,masturbating,"alsoPlayingStage=9,alsoPlaying=monika",neutral,"She's lookin' at you, ~player~.",,False,9
,,,,,,,,
nayru,0-4,female_removed_accessory,"target=monika,targetStage=3",shocked,W... what just...? You were supposed to...,,False,3
nayru,0-4,female_removed_accessory,"target=monika,targetStage=3",shocked,I really liked your... your blazer... where did...?,,False,3
nayru,0-4,female_removing_accessory,"targetStage=2,target=monika",interested,"Just the ~clothing~? That's fair, really. N-next...",,False,2
nayru,0-1,okay_hand,"notSaidMarker=dire,alsoPlaying=monika",dire,There's something here. Something...,dire,False,
nayru,0-1,okay_hand,"notSaidMarker=dire,alsoPlaying=monika",dire,Monika... do you feel well? There's something wrong...,dire,False,
nayru,0-1,okay_hand,"notSaidMarker=lessdire,alsoPlaying=monika,saidMarker=dire",awkward,"I'm sorry, Monika. It's not you. Let's... move on. I'm Nayru. Good to meet you.",lessdire,False,
nayru,0-1,okay_hand,"notSaidMarker=lessdire,alsoPlaying=monika,saidMarker=dire",calm,"No, I... I'm sorry, Monika. I shouldn't have addressed you that way. My name is Nayru; pleasure to meet you.",lessdire,False,
nayru,0-1,okay_hand,"notSaidMarker=lessdire,alsoPlaying=monika,saidMarker=dire",embarrassed,"It's nothing, I'm sure. Perhaps I was rude; I'm Nayru. It's nice to meet you.",lessdire,False,
nayru,0-1,bad_hand,"notSaidMarker=dire,alsoPlaying=monika",dire,There's something here. Something...,dire,False,
nayru,0-1,bad_hand,"notSaidMarker=dire,alsoPlaying=monika",dire,Monika... do you feel well? There's something wrong...,dire,False,
nayru,0-1,bad_hand,"notSaidMarker=lessdire,saidMarker=dire,alsoPlaying=monika",awkward,"I'm sorry, Monika. It's not you. Let's... move on. I'm Nayru. Good to meet you.",lessdire,False,
nayru,0-1,bad_hand,"notSaidMarker=lessdire,saidMarker=dire,alsoPlaying=monika",calm,"No, I... I'm sorry, Monika. I shouldn't have addressed you that way. My name is Nayru; pleasure to meet you.",lessdire,False,
nayru,0-1,bad_hand,"notSaidMarker=lessdire,saidMarker=dire,alsoPlaying=monika",embarrassed,"It's nothing, I'm sure. Perhaps I was rude; I'm Nayru. It's nice to meet you.",lessdire,False,
,,,,,,,,
natsuki,0-3,female_must_strip,"target=monika,targetStage=0",woah,Eh--? <i>Monika</i> lost?,,False,0
natsuki,0-3,female_must_strip,"target=monika,targetStage=1",laugh,"Heheh! Geez Monika, you're really setting a bad example for your club members.",,False,1
natsuki,0-3,female_must_strip,"targetStage=2,target=monika",fear,"Monika lost again? Sorry, I guess I zoned out. I'm feeling kinda weird...",,False,2
natsuki,0-3,female_must_strip,"target=monika,targetStage=3",happy,Heheh!! We get to see Monika looking <i>nervous!</i>,,False,3
natsuki,0-3,female_must_strip,"target=monika,targetStage=4",smug,"You know, Monika, if we keep this up, ~player~ will want us to do <i>this</i> every club meeting.",,False,4
natsuki,0-3,female_must_strip,"target=monika,targetStage=5",smug,"Hmph. <i>I've</i> never thought about how you look naked. I bet a perv like <i>~player~</i> did, though.",,False,5
natsuki,0-3,female_must_strip,"targetStage=6,target=monika",gross,"Urp! Ah! S-sorry, I just feel a little-- I'm fine. (<i>Geez, I'm so light headed...</i>)",,False,6
natsuki,0-3,female_must_strip,"target=monika,targetStage=7",tsun,(<i>What's with that tone? ~player~ doesn't belong to you...</i>),,False,7
natsuki,0-3,female_removing_minor,"target=monika,targetStage=1",upset,A-and now you're (<i>flashing</i>) us again...,,False,1
natsuki,0-3,female_removed_major,"target=monika,targetStage=4",tsun,(<i>I-is she into ~player~!?</i>),,False,4
natsuki,0-3,female_removed_major,"target=monika,targetStage=5",upset,"Nn-- Jeez, that was probably mean of me. S-sorry, ~player~.",,False,5
natsuki,0-3,female_crotch_will_be_visible,target=monika,happy,"Y-you know, this whole thing is pretty weird... but it's fun to beat Monika at something!",,False,7
natsuki,0-3,female_masturbating,target=monika,woah,I-is this... does this look weird to anyone else??,,False,9
natsuki,0-3,female_masturbating,target=monika,smug,"I get to watch her finger that perfect little... Ehehe, I guess I can get a bit pervy too... B-but this is mostly me being a horrible person, n-not gay. (<i>Wait. Fuck.</i>)",,False,9
natsuki,0-3,female_masturbating,target=monika,mad,"H-hey! You stop that, Monika! I can't see while you do weird dream stuff!",,False,9
natsuki,0-3,female_masturbating,target=monika,smug,I'm glad this is a dream. I can stare all I want and nobody thinks I'm a perv.,,False,9
natsuki,0-3,female_masturbating,target=monika,aroused,"Wow, dream Monika really is a whore, huh?",,False,9
natsuki,0-3,female_masturbating,target=monika,laugh,"I-if this is a dream, I can say whatever I want, huh? ...W-well maybe not <i>that</i>.",,False,9
natsuki,0-3,female_crotch_is_visible,target=monika,smug,"Huh... Oh, sorry. I just assumed ""Perfect"" Monika shaved down there. No biggy.",,False,8
natsuki,0-3,female_removed_accessory,"target=monika,targetStage=1",upset,R-right in front of ~player~ too...,,False,1
natsuki,0-3,female_removed_accessory,"target=monika,targetStage=3",fear,H-huh? Where did... When did Monika lose her cardigan..?,,False,3
natsuki,0-3,female_removed_accessory,"targetStage=6,target=monika",upset,"Eh!? And of course you look even prettier this way! You really can make me jealous sometimes, you know!?",,False,6
