id,stages,case,conditions,image,text,marker,silent,targeted stage
elizabeth,0,female_must_strip,"alsoPlaying=natsuki,target=monika,targetStage=0",calm,"I'm afraid so, my dear.",,False,0
elizabeth,0,female_removing_accessory,"alsoPlaying=natsuki,target=monika,targetStage=0",shocked,"Oh, dear! You're right, Natsuki.",,False,0
elizabeth,0,good_hand,"alsoPlaying=monika,totalRounds=0",calm,"Hello, you're Monika, right? That's a lovely name. I'm Elizabeth, nice to meet you!",,False,
elizabeth,0,okay_hand,"alsoPlaying=monika,totalRounds=0",calm,"Hello, you're Monika, right? That's a lovely name. I'm Elizabeth, nice to meet you!",,False,
elizabeth,0,bad_hand,"alsoPlaying=monika,totalRounds=0",calm,"Hello, you're Monika, right? That's a lovely name. I'm Elizabeth, nice to meet you!",,False,
elizabeth,9,female_must_masturbate,"target=monika,tag:ddlc=3",awkward,You have to do <i>this</i> in front of your friends? I'm so sorry.,,False,8
elizabeth,0-10,female_must_strip,"target=monika,alsoPlayingStage=0,alsoPlaying=natsuki,targetStage=1",calm,"I think she is having a bad streak, that's all.",,False,1
elizabeth,0-10,female_must_strip,"target=monika,alsoPlayingStage=0,targetStage=2,alsoPlaying=natsuki",interested,"Are you Okay, Natsuki?",,False,2
elizabeth,0-10,female_must_strip,"target=monika,alsoPlayingStage=0,alsoPlaying=natsuki,targetStage=3",calm,"She does look <i>nervous</i>. Don't be nervous, Monika!",,False,3
elizabeth,0-10,female_must_strip,"target=monika,alsoPlayingStage=0,alsoPlaying=natsuki,targetStage=5",angry,"<i>Did you, ~player~</i>? Poor Monika.",,False,5
elizabeth,0-10,female_must_strip,"target=monika,alsoPlayingStage=0,targetStage=6,alsoPlaying=natsuki",awkward,(maybe Natsuki is pregnant?),,False,6
elizabeth,0-10,female_removing_minor,"target=monika,targetStage=1,tag:ddlc=3",calm,"Those stockings look delightful, but the other girls aren't wearing any. I assume they aren't mandatory in your uniform, right?",,False,1
elizabeth,0-10,female_removing_minor,"totalFemales=5,target=monika,alsoPlaying=natsuki,targetStage=1,tag:ddlc=3",shocked,"Those stockings look delight-... Oh, dear, Natsuki is right! I can see your... Luckily , ~player~, is a girl too.",,False,1
elizabeth,0-10,female_removing_minor,"target=monika,alsoPlaying=natsuki,totalMales=1,targetStage=1,tag:ddlc=3",shocked,"Those stockings look delight-... Oh, dear, Natsuki is right! I can see your... ,~player~, close your eyes!",,False,1
elizabeth,0-10,female_removing_minor,"alsoPlaying=monika,target=natsuki,targetStage=1,alsoPlayingStage=3,tag:ddlc=3",happy,"I really like your blazers, a shame you're removing yours and Monika lost hers, as well.",,False,3
elizabeth,0-10,female_removing_minor,"target=sayori,alsoPlaying=monika,targetStage=0,alsoPlayingStage=3,tag:ddlc=3",sad,"Not your blazer too! I guess I have to watch all of your gorgeous uniforms go down if I want to win, huh?",,False,3
elizabeth,0-10,female_removing_minor,"target=sayori,alsoPlaying=monika,alsoPlayingStage=3-6,targetStage=1,tag:ddlc=2",interested,"Oh, that cardigan is cute! I noticed Monika isn't wearing one. You don't like it, Monika?",,False,3-6
elizabeth,0-10,female_removing_minor,"target=monika,alsoPlayingStage=0,alsoPlaying=natsuki,targetStage=1",awkward,"(Oh, dear, she's right, again)",,False,1
elizabeth,0-10,female_removing_minor,"target=sayori,alsoPlaying=monika,alsoPlayingStage=0,targetStage=2",interested,Monika's shoes are slightly different.,,False,0
elizabeth,0-10,female_removed_major,"target=monika,alsoPlaying=natsuki,totalMales=1,targetStage=4,tag:ddlc=3",calm,"Do you like, ~player~, Monika? ... Maybe playing this game wasn't the best idea... He could see you... <i>naked</i>!",,False,4
elizabeth,0-10,female_removed_major,"target=monika,targetStage=5",calm,"You still look decent, my dear. If that's any consolation.",,False,5
elizabeth,0-10,female_crotch_is_visible,"target=monika,tag:ddlc=3",awkward,"You must really like, ~player~.",,False,8
elizabeth,0-10,female_crotch_is_visible,"target=sayori,alsoPlaying=monika,alsoPlayingStage=8,tag:ddlc=2",awkward,...That next Club meeting is gonna be so awkward.,,False,8
elizabeth,0-10,female_removed_accessory,"target=monika,targetStage=3,tag:ddlc=3",interested,"Oh! I thought you all had cardigans... (Did she just say ""erased""?)",,False,3
elizabeth,0-10,female_removed_accessory,"alsoPlaying=monika,target=natsuki,targetStage=1,tag:ddlc=3",sad,"Don't go, Natuski. Think about, ~player~.",,False,
elizabeth,0-10,female_removed_accessory,"target=monika,targetStage=1",interested,Yeah... sometimes being barefoot feels very nice!,,False,1
elizabeth,0-10,female_removed_accessory,"target=monika,targetStage=3",awkward,"You look nice, even without your blazer. (I wonder what did she mean by ""erased""?)",,False,3
elizabeth,0-10,female_removed_accessory,"targetStage=6,target=monika",calm,"I like your hair very much, Monika.",,False,6
elizabeth,0-10,female_must_masturbate,"target=monika,alsoPlaying=natsuki,alsoPlayingStage=0-8,tag:ddlc=3",interested,"You two are awfully competitive, huh?",,False,8
elizabeth,0-10,female_must_masturbate,"target=monika,alsoPlaying=sayori,tag:ddlc=3",awkward,"Do you do this in front of each other often, Sayori?",,False,8
elizabeth,0-10,female_must_masturbate,"alsoPlaying=monika,target=natsuki,alsoPlayingStage=0-8,tag:ddlc=3",awkward,"At least, Monika is here. Wait... is that good, or bad for you?",,False,0-8
elizabeth,0-10,female_must_masturbate,"alsoPlaying=monika,target=natsuki,alsoPlayingStage=9,totalMales=1,tag:ddlc=3",awkward,Now the two of you? ~player~ must be a happy boy.,,False,9
elizabeth,0-10,female_must_masturbate,"target=sayori,alsoPlaying=monika,alsoPlayingStage=0-8,tag:ddlc=3",calm,"Don't worry, Sayori. I'm sure Monika and Natsuki will still be your friends after this. Me too!",,False,0-8
elizabeth,0-10,female_medium_chest_is_visible,"target=monika,tag:ddlc=3",awkward,Do you usually see each other's breasts?,,False,7
elizabeth,0-10,female_removing_accessory,"target=monika,targetStage=0,tag:ddlc=3",calm,"Monika, your shoes are slightly different colored than the rest. Does the Literature club allow that?",,False,0
elizabeth,0-10,female_removing_accessory,"target=monika,targetStage=5,tag:ddlc=3",happy,"I bet your hair looks lovely down! I'm certain, ~player~, thinks the same.",,False,5
elizabeth,0-10,female_removing_accessory,"alsoPlaying=monika,target=natsuki,targetStage=0,tag:ddlc=3",calm,"Monika might be right here, Natsuki. What do you think, Sayori?",,False,
elizabeth,0-10,female_removing_accessory,"targetStage=2,target=monika",calm,"Oh, that's a shame! That blazer looks good on you.",,False,2
elizabeth,0-10,female_removing_major,"target=monika,alsoPlaying=natsuki,targetStage=3,tag:ddlc=3",calm,"You look a tad nervous, Monika. Wouldn't you agree, Sayori? Relax, You're among friends.",,False,3
elizabeth,0-10,female_removing_major,"totalFemales=5,target=monika,alsoPlaying=natsuki,targetStage=3,tag:ddlc=3",calm,"You look a tad nervous, Monika... Maybe Monika is into,~player~? B- but, she's a girl too...",,False,3
elizabeth,0-10,female_removing_major,"target=monika,alsoPlaying=natsuki,totalMales=1,targetStage=3,tag:ddlc=3",calm,"You look a tad nervous, Monika... Maybe Monika is into,~player~? What do you think, Sayori?",,False,3
elizabeth,0-10,female_removing_major,"target=monika,alsoPlaying=natsuki,totalMales=1,targetStage=4,tag:ddlc=3",calm,"Do you really think, ~player~, would do that, Natsuki? I don't think he would do that. What do you think, Sayori?",,False,4
elizabeth,0-10,female_chest_will_be_visible,"totalMales=1,target=monika,tag:ddlc=3",shocked,"Oh,dear, ~player~, is going to see your bare chest! Look the other way, ~player~. Be a gentleman!",,False,6
elizabeth,0-10,female_removed_minor,"targetStage=2,target=monika,tag:ddlc=3",interested,"Is it true that you are the club's president? Can I join the club too, or is it exclusively a school thing? I love reading.",,False,2
elizabeth,0-10,female_removed_minor,"alsoPlaying=monika,target=natsuki,targetStage=2,alsoPlayingStage=3,tag:ddlc=3",interested,"You look great in your cardigan, Natsuki. I wonder why Monika isn't wearing one. I thought they were part of your uniforms.",,False,3
elizabeth,0-10,female_removed_minor,"target=monika,alsoPlayingStage=0,targetStage=2,alsoPlaying=natsuki",shocked,Out of charact- Eeep!,,False,2
elizabeth,0-10,female_removed_minor,"target=monika,alsoPlayingStage=0,targetStage=2,alsoPlaying=natsuki",shocked,"Out of charact- Eeep, how rude!",,False,2
elizabeth,0-1,female_removed_minor,"target=sayori,alsoPlaying=monika,alsoPlayingStage=3-6,targetStage=1,tag:natsuki=0",sad,It's such a shame neither of you are wearing your blazers now. I suppose it had to happen if I want to win.,,False,3-6
elizabeth,0-1,good_hand,"totalRounds=1,alsoPlaying=monika",awkward,"Hmm... There's a strange sensation in the air tonight, huh? Monika, do you feel it too?",,False,
elizabeth,0-1,good_hand,"totalRounds=1,alsoPlaying=monika",awkward,"Something feels strangely odd. Like a disturbance in the air, or something. Do you feel it too, Monika?",,False,
elizabeth,0-1,okay_hand,"totalRounds=1,alsoPlaying=monika",awkward,"Hmm... There's a strange sensation in the air tonight, huh? Monika, do you feel it too?",,False,
elizabeth,0-1,bad_hand,"totalRounds=1,alsoPlaying=monika",awkward,"Hmm... There's a strange sensation in the air tonight, huh? Monika, do you feel it too?",,False,
elizabeth,0-9,female_removed_accessory,"targetStage=6,target=monika",calm,"Your hair looks lovely that way, Monika.",,False,6
elizabeth,2-6,female_removed_minor,"target=sayori,alsoPlaying=monika,alsoPlayingStage=3-6,targetStage=1,tag:natsuki=0",sad,It's such a shame neither of you are wearing your blazers now. I'm not wearing mine either. A sad day for fashion.,,False,3-6
elizabeth,0-8,good_hand,"alsoPlaying=monika,alsoPlayingStage=2,alsoPlayingTimeInStage=0,tag:ddlc=3",awkward,I wonder if there's an initiation for new club members? (please don't say spankings),,False,2
elizabeth,0-8,okay_hand,"alsoPlaying=monika,alsoPlayingStage=2,alsoPlayingTimeInStage=0,tag:ddlc=3",awkward,I wonder if there's an initiation for new club members? (please don't say spankings),,False,2
elizabeth,0-8,bad_hand,"alsoPlaying=monika,alsoPlayingStage=2,alsoPlayingTimeInStage=0,tag:ddlc=3",awkward,I wonder if there's an initiation for new club members? (please don't say spankings),,False,2
elizabeth,"0-8,10",female_must_masturbate,"target=monika,tag:ddlc=3",awkward,You have to do <i>that</i> in front of your friends? I'm so sorry.,,False,8
elizabeth,"0-8,10",female_must_masturbate,"target=monika,alsoPlayingStage=9,alsoPlaying=natsuki,tag:ddlc=3",awkward,"At least you'll be together doing <i>that</i>. (I'm not so sure, that's good)",,False,8
elizabeth,7-10,female_removed_minor,"target=sayori,alsoPlaying=monika,alsoPlayingStage=3-6,targetStage=1,tag:natsuki=0",sad,It's such a shame neither of you are wearing your blazers now. I'm not wearing mine either... I wish I was.,,False,3-6
elizabeth,1-8,good_hand,"alsoPlayingSaidMarker=psa_deliver,alsoPlaying=monika,notSaidMarker=erased",awkward,What did just happen? I... I feel like I was erased for a few seconds...,erased,False,
elizabeth,1-8,good_hand,"alsoPlayingSaidMarker=round-glitched,notSaidMarker=odd,alsoPlaying=monika",awkward,"I feel odd... Like, er... glitched?",odd,False,
,,,,,,,,
meia,0-7,female_must_strip,"target=monika,targetStage=3",disappointed,What exactly is your fascination with ~player~?  Do you know them from somewhere?,,False,3
meia,0-7,female_must_strip,"target=monika,targetStage=3",disappointed,Is there a reason you're fixated on ~player~?  What's the meaning of this constant attention?,,False,3
meia,0-7,female_must_strip,"target=monika,targetStage=3",bored,"Whatever your ulterior motives are, you're making it awfully clear you only care about ~player~.",,False,3
meia,0-7,female_must_strip,"target=monika,targetStage=3",disappointed,"I don't know why this girl is fixated on you, ~player~, but I would be wary of her.",,False,3
meia,0-7,female_must_strip,"target=monika,targetStage=3,saidMarker=femplayer",disappointed,What exactly is your fascination with ~player~?  Do you know her from somewhere?,,False,3
meia,0-7,female_must_strip,"target=monika,targetStage=3,saidMarker=femplayer",critical,Is there a reason you're fixated on ~player~?  What's the meaning of this constant attention?,,False,3
meia,0-7,female_must_strip,"target=monika,targetStage=3,saidMarker=femplayer",bored,"Whatever your ulterior motives are, you're making it awfully clear you only care about ~player~.",,False,3
meia,0-7,female_must_strip,"target=monika,targetStage=3,saidMarker=femplayer",disappointed,"I don't know why this girl is fixated on you, ~player~, but I would be wary of her.",,False,3
meia,0-7,female_must_strip,"saidMarker=maleplayer,target=monika,targetStage=3",disappointed,What exactly is your fascination with ~player~?  Do you know him from somewhere?,,False,3
meia,0-7,female_must_strip,"saidMarker=maleplayer,target=monika,targetStage=3",critical,Is there a reason you're fixated on ~player~?  What's the meaning of this constant attention?,,False,3
meia,0-7,female_must_strip,"saidMarker=maleplayer,target=monika,targetStage=3",bored,"Whatever your ulterior motives are, you're making it awfully clear you only care about ~player~.",,False,3
meia,0-7,female_must_strip,"saidMarker=maleplayer,target=monika,targetStage=3",disappointed,"I don't know why this girl is fixated on you, ~player~, but I would be wary of her.",,False,3
meia,0-7,female_masturbating,"target=monika,targetSaidMarker=joint-masturbation",shocked,M-Monika--I--I could never...are you alright?  You want Sayori to do this?,claustrophobia,False,9
meia,0-7,female_masturbating,"target=monika,targetSaidMarker=joint-masturbation",angry,<i>S-Sayori</i>!  Who told you--did Monika agree to this?,claustrophobia,False,9
meia,0-7,female_masturbating,"target=monika,targetSaidMarker=joint-masturbation",surprised-horny,"A-after...flirting with ~player~, I didn't think--<i>is the bondage necessary</i>?",claustrophobia,False,9
meia,0-7,female_masturbating,"target=monika,targetSaidMarker=joint-masturbation",angry,"T-tied up...?  T-this is horrible!  Sayori, what are you--I-I--you--!",claustrophobia,False,9
meia,0-7,female_masturbating,"target=monika,targetSaidMarker=joint-masturbation",angry,D-don't--<i>don't you dare come near me with those</i>!,claustrophobia,False,9
meia,0-7,female_masturbating,"target=monika,targetSaidMarker=joint-masturbation",thinking,Ropes...<i>constriction</i>.  This is too much for one night...,claustrophobia,False,9
meia,0-7,female_start_masturbating,"targetSaidMarker=joint-masturbation,target=monika",shocked,<i>Wha--what is this</i>?  What kind of pervert--are those <i>ropes</i>?,claustrophobia,False,8
meia,0-7,female_start_masturbating,"targetSaidMarker=joint-masturbation,target=monika",shocked,"<i>R-ropes</i>?  Monika, are you--consenting to this?",claustrophobia,False,8
meia,0-7,female_start_masturbating,"targetSaidMarker=joint-masturbation,target=monika",shocked,I should've known you two were in lo--<i>wha--r-ropes</i>?  I-I--,claustrophobia,False,8
meia,0-7,female_start_masturbating,"targetSaidMarker=joint-masturbation,target=monika",shocked,"Typical oversexed schoolgirls, touching each other...<i>u-uh</i>--are those ropes?  Are you--?",claustrophobia,False,8
meia,0-7,female_finished_masturbating,"targetSaidMarker=joint-masturbation,target=monika",awkward,...It's over...finally.  I--I'm sorry...I panicked.,,False,10
meia,0-7,female_finished_masturbating,"targetSaidMarker=joint-masturbation,target=monika",thinking,"I--I can't lose control like that.  I'm sorry I made a scene, Monika...",,False,10
meia,0-7,female_finished_masturbating,"targetSaidMarker=joint-masturbation,target=monika",awkward,"You--you consented to that, yes?  I'm sorry I made such a commotion...",,False,10
meia,0-7,female_finished_masturbating,"targetSaidMarker=joint-masturbation,target=monika",awkward,So...you two agreed to that?  I panicked...my apologies.,,False,10
meia,0-5,female_must_strip,"target=monika,targetStage=0",disappointed,They said you're a student...but something about you seems intense.  Like you know more than you let on...,,False,0
meia,0-5,female_must_strip,"target=monika,targetStage=0",disappointed,I'm told you're a student.  The uniform matches...but something in your eyes doesn't.,,False,0
meia,0-5,female_must_strip,"target=monika,targetStage=0",disappointed,"I know this is rude, but...something seems off about you.  What did you say you did?  You're a student?",,False,0
meia,0-5,female_must_strip,"target=monika,targetStage=0",disappointed,"For a supposed student, there's something about the way you carry yourself that makes me wary...like you're one step ahead of us.",,False,0
meia,0-5,female_must_strip,"target=monika,alsoPlaying=sayori,alsoPlayingStage=0,targetStage=0,tag:ddlc=2",critical,"...Sayori, are sure you want to hang around this girl?  She...seems off.",,False,0
meia,0-5,female_must_strip,"target=monika,alsoPlaying=sayori,alsoPlayingStage=0,targetStage=0,tag:ddlc=2",critical,"I'd be wary if this girl is your friend, Sayori.  It's my job to spot threats...",,False,0
meia,0-5,female_must_strip,"target=monika,alsoPlaying=sayori,alsoPlayingStage=0,targetStage=0,tag:ddlc=2",critical,"If this girl is who you'd call a friend, Sayori...then I'd say you should work on your character judgment.  She isn't trustworthy.",,False,0
meia,0-5,female_must_strip,"target=monika,alsoPlaying=sayori,alsoPlayingStage=0,targetStage=0,tag:ddlc=2",critical,"I lived on the streets for a time...I know when a woman is manipulating others for her purposes.  Monika isn't your friend, Sayori.",,False,0
meia,0-5,female_must_strip,"target=sayori,alsoPlaying=monika,alsoPlayingStage=0,targetStage=0,tag:ddlc=2",critical,"...Sayori, are sure you want to hang around this girl?  She...seems off.",,False,0
meia,0-5,female_must_strip,"target=sayori,alsoPlaying=monika,alsoPlayingStage=0,targetStage=0,tag:ddlc=2",critical,"I'd be wary if this girl is your friend, Sayori.  It's my job to spot threats...",,False,0
meia,0-5,female_must_strip,"target=sayori,alsoPlaying=monika,alsoPlayingStage=0,targetStage=0,tag:ddlc=2",critical,"If this girl is who you'd call a friend, Sayori...then I'd say you should work on your character judgment.  She isn't trustworthy.",,False,0
meia,0-5,female_must_strip,"target=sayori,alsoPlaying=monika,alsoPlayingStage=0,targetStage=0,tag:ddlc=2",critical,"I lived on the streets for a time...I know when a woman is manipulating others for her purposes.  Monika isn't your friend, Sayori.",,False,0
meia,0-5,female_removing_accessory,"target=monika,targetStage=0",disappointed,The typical response of a woman with something to hide.,,False,0
meia,0-5,female_removing_accessory,"target=monika,targetStage=0",disappointed,Your sudden panic is very convincing.,,False,0
meia,0-5,female_removing_accessory,"target=monika,targetStage=0",disappointed,...The least you could do is make an effort to convince me of that.,,False,0
meia,0-5,female_removing_accessory,"target=monika,targetStage=0",disappointed,...Right.  That's obvious from the worry on your face.,,False,0
meia,0-1,good_hand,"totalRounds=1,alsoPlaying=monika,tag:ddlc=2,tag:natsuki=1",disappointed,...You two know each other?  You're wearing the same uniform...but Monika actually looks like an adult.,,False,
meia,0-1,good_hand,"totalRounds=1,alsoPlaying=monika,tag:ddlc=2,tag:natsuki=1",annoyed,"...Monika, don't bring your younger classmates to strip poker games.  This is for adults.",,False,
meia,0-1,good_hand,"totalRounds=1,alsoPlaying=monika,tag:ddlc=2,tag:natsuki=1",bored,The same uniform?  ...Don't tell me this is some kind of perverted school field trip.  Natsuki doesn't even look old enough.,,False,
meia,0-1,good_hand,"totalRounds=1,alsoPlaying=monika,tag:ddlc=2,tag:natsuki=1",disappointed,"I was about to comment on the look in your eyes, Monika, but I'm more worried about your underage schoolmate.",,False,
meia,0-1,okay_hand,"totalRounds=1,alsoPlaying=monika,tag:ddlc=2,tag:natsuki=1",disappointed,...You two know each other?  You're wearing the same uniform...but Monika actually looks like an adult.,,False,
meia,0-1,okay_hand,"totalRounds=1,alsoPlaying=monika,tag:ddlc=2,tag:natsuki=1",annoyed,"...Monika, don't bring your younger classmates to strip poker games.  This is for adults.",,False,
meia,0-1,okay_hand,"totalRounds=1,alsoPlaying=monika,tag:ddlc=2,tag:natsuki=1",bored,The same uniform?  ...Don't tell me this is some kind of perverted school field trip.  Natsuki doesn't even look old enough.,,False,
meia,0-1,okay_hand,"totalRounds=1,alsoPlaying=monika,tag:ddlc=2,tag:natsuki=1",disappointed,"I was about to comment on the look in your eyes, Monika, but I'm more worried about your underage schoolmate.",,False,
meia,0-1,bad_hand,"totalRounds=1,alsoPlaying=monika,tag:ddlc=2,tag:natsuki=1",disappointed,...You two know each other?  You're wearing the same uniform...but Monika actually looks like an adult.,,False,
meia,0-1,bad_hand,"totalRounds=1,alsoPlaying=monika,tag:ddlc=2,tag:natsuki=1",annoyed,"...Monika, don't bring your younger classmates to strip poker games.  This is for adults.",,False,
meia,0-1,bad_hand,"totalRounds=1,alsoPlaying=monika,tag:ddlc=2,tag:natsuki=1",bored,The same uniform?  ...Don't tell me this is some kind of perverted school field trip.  Natsuki doesn't even look old enough.,,False,
meia,0-1,bad_hand,"totalRounds=1,alsoPlaying=monika,tag:ddlc=2,tag:natsuki=1",disappointed,"I was about to comment on the look in your eyes, Monika, but I'm more worried about your underage schoolmate.",,False,
,,,,,,,,
misato,0-4,female_must_strip,"target=monika,targetStage=0",Surprised,(I don't get this... ~name~ is just a normal student. Why does she makes me so uncomfortable?),,False,0
misato,0-4,female_must_strip,"target=monika,targetStage=0",Surprised,(Monika is just a common student. Why is her presence so unnerving?),,False,0
misato,0-8,female_finished_masturbating,target=monika,Surprised,(I feel something wrong...),,False,10
misato,0-8,female_finished_masturbating,target=monika,Surprised,(<i>Why</i> is she so mysterious?),,False,10
,,,,,,,,
pit,0-7,female_must_strip,"target=monika,targetStage=0",beat,"Maybe it's just me, but things feel a little... off.",,False,0
pit,0-7,female_removing_minor,"target=monika,targetStage=1",happy,"So do you know ~player~, Monika? You can hardly tear your eyes away...",,False,1
pit,0-7,female_removed_major,"target=monika,targetStage=4",thinking,"I didn't think you were the stammering type, Monika. You seem so collected.",,False,4
pit,0-7,female_removed_major,"target=monika,targetStage=5",beat,"It seems that way, yeah. Or do you have a trick up your sleeve?",,False,5
pit,0-7,female_crotch_will_be_visible,target=monika,devoted,The last piece... the final hit!,,False,7
pit,0-7,female_masturbating,"target=monika,priority=0",awkward,"You're pretty lucky, ~player~. I sure wouldn't mind having a cute girl like her touch herself to the thought of me. Uh, I mean, what?",,False,9
pit,0-7,female_masturbating,"targetSaidMarker=joint-masturbation,target=monika,priority=0",shy,"(Is this what usually happens in ""clubs""?)",,False,9
pit,0-7,female_crotch_is_visible,target=monika,shy,"Wow, ~player~'s really enjoying this from what I can see. But I can't tell if it's a scared look or an aroused one...",,False,8
pit,0-7,female_start_masturbating,target=monika,devoted,"Just like that! ...I think. I've never seen someone do this before tonight, so you really shouldn't ask me for advice.",,False,8
pit,0-7,female_start_masturbating,"targetSaidMarker=joint-masturbation,target=monika",embarrassed,"Wait, tying her up? How will she do the forfeit, then?",,False,8
pit,0-7,female_removed_accessory,"target=monika,targetStage=1",pumped,Of course! There's not very many better feelings than getting to let your feet breathe!,,False,1
pit,0-7,female_removed_accessory,"target=monika,targetStage=3",surprised,"...<i>What</i> game are you from, again?",,False,3
pit,0-7,female_removed_accessory,"targetStage=6,target=monika",happy,You've got a nice style! Maybe you should wear your hair like that a bit more often!,,False,6
pit,0-7,female_must_masturbate,target=monika,shy,"I'm sure this is something you're not used to, Monika, but you'll do great! ~player~ is here to help, after all!",,False,8
pit,0-7,female_must_masturbate,"target=monika,alsoPlaying=sayori,alsoPlayingStage=8-9,alsoPlayingSaidMarker=affections-glitch",surprised,"Uh, Sayori? What's that look in your eye?",,False,8
pit,0-7,female_medium_chest_is_visible,target=monika,awkward,"Something tells me our friend isn't going to give you feedback. But that look says it all, right?",,False,7
pit,0-7,female_removing_accessory,"target=monika,targetStage=0",awkward,"Ah, shoes. A boring yet practical choice.",,False,0
pit,0-7,female_removing_accessory,"targetStage=2,target=monika",stunned,Oh! That was... fast.,,False,2
pit,0-7,female_removing_accessory,"target=monika,targetStage=5",stunned,"Oh, right! That's a good idea.",,False,5
pit,0-7,female_removing_major,"target=monika,targetStage=3",joking,Just take it slow if you need to. No need to rush. Again.,,False,3
pit,0-7,female_removing_major,"target=monika,targetStage=4",awkward,"Don't worry, Monika. We're all in the same boat... more or less.",,False,4
pit,0-7,female_finished_masturbating,target=monika,thinking,"This is a really wholesome thing we have going here, but somehow I still feel like something's wrong...",,False,10
pit,0-7,female_finished_masturbating,"targetNotSaidMarker=joint-masturbation-finished,targetSaidMarker=joint-masturbation,target=monika",shy,"Hey, uh, Sayori... are you gonna untie her or what?",,False,10
pit,0-7,female_chest_will_be_visible,target=monika,beat,"She's all yours, buddy.",,False,6
pit,0-7,female_removed_minor,"targetStage=2,target=monika",joking,"Right? Like I said earlier, it's nice.",,False,2
