id,stages,case,conditions,image,text,marker,silent,targeted stage
natsuki,0-3,female_medium_chest_is_visible,target=monika,boobenvy,Oh...,,False,7
natsuki,0-3,female_removing_accessory,"target=monika,targetStage=0",isthatapenis,M-Monika! Everyone can...(<i>see your panties!</i>),,False,0
natsuki,0-3,female_removing_accessory,"targetStage=2,target=monika",smug,"You're just taking off your blazer, right? Smart move, Pres--",,False,2
natsuki,0-3,female_removing_accessory,"target=monika,targetStage=5",embarrassed,"O-oh. Huh. Come to think of it, I've never seen you with your hair down...",,False,5
natsuki,0-3,female_removing_major,"target=monika,targetStage=3",woah,Huh..? (<i>She's avoiding ~player~'s eyes...</i>),,False,3
natsuki,0-3,female_removing_major,"target=monika,notSaidMarker=player_f,targetStage=4",smug,"What a pervert, right? I bet ~player~ only joined the club to be with cute girls, like he's in some gross dating sim.",,False,4
natsuki,0-3,female_removing_major,"target=monika,saidMarker=player_f,targetStage=4",smug,"What a pervert, right? I mean, he's the one that broke up our... wait a second, ~player~'s a girl...",,False,4
natsuki,0-3,female_finished_masturbating,target=monika,aroused,"You know, Monika, this whole thing was really weird, but I can't get mad at <i>you</i> for some reason...",,False,10
natsuki,0-3,female_chest_will_be_visible,target=monika,boobenvy,"(<i>If Monika went after ~player~ seriously, I don't think I would stand a chance...</i>)",,False,6
natsuki,0-3,female_removed_minor,"targetStage=2,target=monika",fear,"...Doing it again kind of... I dunno, this seems a little... out of character for you. You're not usually this slut-- Eep!!",,False,2
natsuki,0-3,good_hand,"alsoPlayingStage=1,alsoPlaying=monika,alsoPlayingTimeInStage=0",smug,"Pretty, classy, but not outstanding. She just blends into whatever she's trying like she's a natural.",,False,1
natsuki,0-3,okay_hand,"alsoPlayingStage=1,alsoPlaying=monika,alsoPlayingTimeInStage=0",smug,"Pretty, classy, but not outstanding. She just blends into whatever she's trying like she's a natural.",,False,1
natsuki,0-3,okay_hand,"alsoPlayingTimeInStage=0,alsoPlaying=monika,alsoPlayingStage=3",woah,"I didn't imagine that, right ~player~? Monika's jacket and cardigan just... but that's stupid! They couldn't have just <i>vanished</i>!",,False,3
natsuki,0-3,swap_cards,"alsoPlayingStage=1,alsoPlaying=monika,alsoPlayingTimeInStage=0",calm,That's Monika for you. ~cards~.,,False,1
natsuki,0-3,swap_cards,"alsoPlayingTimeInStage=0,alsoPlaying=monika,alsoPlayingStage=2",upset,"I-I'm sorry Monika, I...",,False,2
natsuki,0-3,swap_cards,"alsoPlayingStage=5,alsoPlaying=monika,alsoPlayingTimeInStage=0",upset,"(<i>Calm down, idiot...</i>) ~cards~.",,False,5
natsuki,0-3,bad_hand,"alsoPlayingStage=1,alsoPlaying=monika,alsoPlayingTimeInStage=0",smug,"Pretty, classy, but not outstanding. She just blends into whatever she's trying like she's a natural.",,False,1
natsuki,4-6,female_must_strip,"target=monika,targetStage=0",tsun,"It's about time! Jeez, Monika... Do you really have to be the best at everything?",,False,0
natsuki,4-6,female_must_strip,"target=monika,targetStage=1",happy,It's about time you got taken down another peg!,,False,1
natsuki,4-6,female_must_strip,"targetStage=2,target=monika",fear,"I feel funny, like my words and my actions are totally in sync...",,False,2
natsuki,4-6,female_must_strip,"target=monika,targetStage=3",laugh,What's wrong Monika? You look embarrassed! Surely <i>perfect</i> Monika isn't <i>shy</i>...,,False,3
natsuki,4-6,female_must_strip,"target=monika,targetStage=4",happy,"Ahaha! Just look at how <i>excited</i> ~player~ is getting, Monika!",,False,4
natsuki,4-6,female_must_strip,"target=monika,targetStage=5",embarrassed,Is it time for some underwear? B-better you than me...,,False,5
natsuki,4-6,female_must_strip,"targetStage=6,target=monika",gross,"Urp! Nn! Uh, d-don't mind me! I just choked a little... (<i>Deep breaths...</i>)",,False,6
natsuki,4-6,female_removing_minor,"target=monika,targetStage=1",happy,"Monika, if this were a manga, you could probably just get away with the first panty flash...",,False,1
natsuki,4-6,female_removed_major,"target=monika,targetStage=4",mad,... (<i>That bitch..!</i>),,False,4
natsuki,4-6,female_removed_major,"target=monika,targetStage=5",upset,"I-- I'm sorry, ~player~. I-I didn't mean it. I didn't mean it!",,False,5
natsuki,4-6,female_crotch_will_be_visible,target=monika,laugh,"W-wow, sorry you lost, Monika. I guess it's time for you to reveal your ""true self"", huh?",,False,7
natsuki,4-6,female_crotch_is_visible,target=monika,smug,"Huh..? Oh, sorry. I just assumed ""Perfect"" Monika shaved down there. No biggy.",,False,8
natsuki,4-6,female_removed_accessory,"target=monika,targetStage=1",upset,I guess even Miss Perfect President can be careless sometimes...,,False,1
natsuki,4-6,female_removed_accessory,"target=monika,targetStage=3",fear,Did Monika remove her cardigan? I though she was still on her blazer...,,False,3
natsuki,4-6,female_removed_accessory,"targetStage=6,target=monika",upset,"And to add insult to injury, she has this hot ""bedroom"" look to her now, with her hair down...",,False,6
natsuki,4-6,female_medium_chest_is_visible,target=monika,boobenvy,(<i>Sh-she's openly flirting with ~player~ now...</i>),,False,7
natsuki,4-6,female_removing_accessory,"target=monika,targetStage=0",embarrassed,"(<i>Pst! </i>Monika,<i> you're </i>flashing<i> everyone!</i>)",,False,0
natsuki,4-6,female_removing_accessory,"targetStage=2,target=monika",fear,"N-no, that's the opposite of what I meant... W-wait, did..?",,False,2
natsuki,4-6,female_removing_accessory,"target=monika,targetStage=5",tsun,"What? Ugh. (<i>Fuck you, Monika...</i>)",,False,5
natsuki,4-6,female_removing_major,"target=monika,notSaidMarker=player_f,targetStage=4",smug,S-so pervy of him. He's pretty much a total scumbag. He only joined our club because--,,False,4
natsuki,4-6,female_removing_major,"target=monika,saidMarker=player_f,targetStage=4",smug,S-so pervy of her. She's pretty much a total dyke. She only joined our club because--,,False,4
natsuki,4-6,female_removed_minor,"targetStage=2,target=monika",smug,"I dunno, this seems a little... <i>slutty</i> for you. (<i>W-wait, what did I just...</i>)",,False,2
natsuki,4-6,female_must_strip,"target=monika,targetStage=7,notSaidMarker=player_f",tsun,(<i>She's practically jumping on his dick...</i>),,False,7
natsuki,4-6,female_must_strip,"saidMarker=player_f,target=monika,targetStage=7",tsun,(<i>She's practically jumping on his dick... H-her dick. Her pussy.</i>),,False,7
natsuki,4-6,female_removing_major,"target=monika,targetStage=3,notSaidMarker=player_f",fear,Huh..? Y-you're avoiding ~player~'s eyes... Y-you're not afraid that he...,,False,3
natsuki,4-6,female_removing_major,"target=monika,targetStage=3,saidMarker=player_f",fear,Huh..? Y-you're avoiding ~player~'s eyes... Y-you're not afraid that she...,,False,3
natsuki,4-6,female_chest_will_be_visible,"targetStage=6,target=monika",aroused,"Oh, M-monika's taking off her...",,False,6
natsuki,7-10,female_must_strip,"targetStage=2,target=monika",fear,"Nn-- It's like I'm seeing strange flickering stuff, people are talking funny... Like this is all a weird dream...",,False,2
natsuki,7-10,female_must_strip,"target=monika,targetStage=4",smug,"You know, Monika, if you keep this up, ~player~ might get the wrong idea.",,False,4
natsuki,7-10,female_must_strip,"target=monika,targetStage=5",smug,Time for some underwear!! (<i>I'm kinda excited..!</i>),,False,5
natsuki,7-10,female_removing_minor,"target=monika,targetStage=1",tsun,"(<i>I said that, but... she's showing her panties again. That can't be an accident...</i>)",,False,1
natsuki,7-10,female_removed_major,"target=monika,targetStage=5",upset,Fuck. Um. S-sorry. That was a lie. M-mostly. Partially.,,False,5
natsuki,7-10,female_crotch_will_be_visible,target=monika,tsun,Jeez. I bet you're going to have gotten some fancy wax instead of having to just shave it yourself...,,False,7
natsuki,7-10,female_crotch_is_visible,target=monika,woah,"Oh, you don't shave? I don't know why I just assumed you shaved.",,False,8
natsuki,7-10,female_removed_accessory,"target=monika,targetStage=1",happy,I-it's kinda weird... seeing Miss Perfect's panties...,,False,1
natsuki,7-10,female_removed_accessory,"target=monika,targetStage=1",embarrassed,I-it's kinda weird... seeing Miss Perfect's panties...,,False,1
natsuki,7-10,female_removed_accessory,"target=monika,targetStage=3",calm,"Uh, wait, where did her cardigan go? D-did I zone out again?",,False,3
natsuki,7-10,female_removed_accessory,"targetStage=6,target=monika",boobenvy,"N-not that I'm disappointed. You're not my type. ...I mean, <i>girls</i> aren't my type!",,False,6
natsuki,7-10,female_medium_chest_is_visible,target=monika,boobenvy,"(<i>D-damn it, she's closing the gap... W-wait, this isn't a race to the bottom!!</i>)",,False,7
natsuki,7-10,female_removing_accessory,"target=monika,targetStage=0",embarrassed,"Ah, Monika, you're--!",,False,0
natsuki,7-10,female_removing_accessory,"targetStage=2,target=monika",embarrassed,L-like one of those dreams where you're naked at school... (<i>and kinda turned on...</i>),,False,2
natsuki,7-10,female_removing_accessory,"target=monika,targetStage=5",upset,Oh. Or not.,,False,5
natsuki,7-10,female_removing_major,"target=monika,notSaidMarker=player_f,targetStage=4",smug,He's a dangerous pervert after all. Did you know he lifted up my skirt when nobody was--,,False,4
natsuki,7-10,female_removing_major,"target=monika,saidMarker=player_f,targetStage=4",smug,"~player~'s totally in the closet. In fact, once she even lifted up my skirt and--",,False,4
natsuki,7-10,female_removed_minor,"targetStage=2,target=monika",smug,"Y-you know, showing your panties again-- That can't be an accident, right? Is our president being <i>slut</i>--!?",,False,2
natsuki,7-10,female_must_strip,"target=monika,targetStage=7,notSaidMarker=player_f",tsun,"(<i>Wow, Monika. Just suck him off already...</i>)",,False,7
natsuki,7-10,female_must_strip,"saidMarker=player_f,target=monika,targetStage=7",tsun,"(<i>Wow, Monika. Just eat her out already...</i>)",,False,7
natsuki,7-10,female_must_strip,"target=monika,targetStage=1,notSaidMarker=player_f",laugh,Monika again? Eheheh... I can't imagine what <i>~player~</i> thinks about you getting naked for him!,,False,1
natsuki,7-10,female_must_strip,"saidMarker=player_f,target=monika,targetStage=1",happy,"Monika again? Eheheh... Good thing ~player~'s a girl, or you'd be really embarrassed, huh?",,False,1
natsuki,7-8,female_must_strip,"target=monika,targetStage=0",tsun,"Jeez. Monika, you're amazing at <i>cards</i> too..? I've already lost a bunch of times...",,False,0
natsuki,7-8,female_must_strip,"target=monika,targetStage=3",laugh,Ha! Monika blushing? Looking shy? Who are you and what have you done with the real Monika?,,False,3
natsuki,7-8,female_removed_major,"target=monika,targetStage=4",woah,"W-wait, y-you aren't right..? (<i>Right..?</i>)",,False,4
natsuki,7-8,female_removing_major,"target=monika,targetStage=3",happy,Heheh... Don't tell me that you're afraid of ~player~ seeing...,,False,3
natsuki,9,masturbating,"alsoPlayingStage=9,alsoPlaying=monika",happy,"Y-you know Monika, I bet you could show me a trick or two...",,False,9
natsuki,9,masturbating,"alsoPlayingStage=9,alsoPlaying=monika",embarrassed,"Ehehe, this is so gross, it's like it's just Monika and me here...",,False,9
natsuki,9,masturbating,"totalFinished=0,alsoPlaying=monika,totalMasturbating=1,priority=0",upset,"Monika, don't m-make me do this alone.",,False,
natsuki,9,masturbating,"totalFinished=0,alsoPlaying=monika,totalMasturbating=1,priority=0",embarrassed,(<i>Monika's... Why do I always lose at things when she's...</i>),,False,
natsuki,10,finished_masturbating,"alsoPlayingStage=-10,alsoPlaying=monika,priority=0",happy,"I guess we both suck at this, huh Monika?",,False,-10
natsuki,10,finished_masturbating,"alsoPlayingStage=-10,alsoPlaying=monika,priority=0",smug,"Wow, even the great Monika can lose. N-not that I did much better.",,False,-10
natsuki,10,finished_masturbating,"alsoPlayingStage=-10,alsoPlaying=monika,priority=0",zsleep1,Can you fall asleep in a dream... Cause...,,False,-10
natsuki,10,finished_masturbating,"alsoPlayingStage=-10,alsoPlaying=monika,priority=0",smug,"That's what you get for playing against me, Monika. I may have lost, but I took you down with me!",,False,-10
natsuki,10,game_over_defeat,target=monika,zsleep2,Oh... Monika..? Of course she did... Zzzzzzzz...,,False,
natsuki,0,selected,alsoPlaying=monika,calm,"Hey ~player~-- Hm? Oh, and Monika too.",,False,
natsuki,0,good_hand,"alsoPlaying=monika,totalRounds=0,priority=700",woah,"Hey, Monika, did I get lost somehow? I thought we had Literature Club today... But we're playing poker..?",,False,
natsuki,0,good_hand,"alsoPlaying=monika,totalRounds=0,priority=700",tsun,"Last I remember, I caught Monika following ~player~... and now I'm playing poker?",follow_the_moni,False,
natsuki,0,okay_hand,"alsoPlaying=monika,totalRounds=0,priority=700",woah,"Hey, Monika, did I get lost somehow? I thought we had Literature Club today... But we're playing poker..?",,False,
natsuki,0,okay_hand,"alsoPlaying=monika,totalRounds=0,priority=700",woah,"Last I remember, I caught Monika following ~player~... and now I'm playing poker?",follow_the_moni,False,
natsuki,0,bad_hand,"alsoPlaying=monika,totalRounds=0,priority=700",woah,"Hey, Monika, did I get lost somehow? I thought we had Literature Club today... But we're playing poker..?",,False,
natsuki,0,bad_hand,"alsoPlaying=monika,totalRounds=0,priority=700",woah,"Last I remember, I caught Monika following ~player~... and now I'm playing poker?",follow_the_moni,False,
natsuki,0,must_strip_normal,"alsoPlayingStage=1-10,alsoPlaying=monika",upset,"W-well, I guess if Monika's done it, I kinda have to...",,False,1-10
natsuki,0,must_strip_normal,"alsoPlayingStage=1-10,alsoPlaying=monika",upset,"Jeez, Monika... You're kinda painting me into a corner here. What else can I do but join in when you've already...",,False,1-10
natsuki,0,must_strip_normal,"alsoPlayingStage=1-10,alsoPlaying=monika",upset,"I don't want to, b-but if Monika already has...",,False,1-10
natsuki,0,must_strip_winning,"alsoPlayingStage=1-10,alsoPlaying=monika",upset,"W-well, I guess if Monika's done it, I kinda have to...",,False,1-10
natsuki,0,must_strip_winning,"alsoPlayingStage=1-10,alsoPlaying=monika",upset,"Jeez, Monika... You're kinda painting me into a corner here. What else can I do but join in when you've already...",,False,1-10
natsuki,0,must_strip_winning,"alsoPlayingStage=1-10,alsoPlaying=monika",upset,"I don't want to, b-but if Monika already has...",,False,1-10
natsuki,0-10,female_must_strip,"target=monika,alsoPlaying=sayori,alsoPlayingSaidMarker=affections-glitch,targetStage=4",smug,As if we haven't seen them twice already. (<i>It's almost as if Sayori's...</i>),,False,4
natsuki,0-10,female_must_strip,"target=monika,alsoPlaying=sayori,alsoPlayingSaidMarker=affections-glitch,targetStage=5",aroused,"(<i>Okay, so Monika's fixing to take of some underwear. How's Sayori going to react??</i>)",,False,5
natsuki,0-10,female_must_strip,"target=monika,alsoPlaying=sayori,alsoPlayingSaidMarker=affections-glitch,targetStage=7",calm,(<i>So Monika seems a bit cold. As normal.</i>),,False,7
natsuki,0-10,female_removed_major,"target=monika,alsoPlaying=sayori,alsoPlayingSaidMarker=affections-glitch,targetStage=4",mad,Sayori? What's wrong?? Sayori?,,False,4
natsuki,0-10,female_removed_major,"target=monika,alsoPlaying=sayori,alsoPlayingSaidMarker=affections-glitch,targetStage=5",isthatapenis,(<i>Whatthefuck whatthefuck whatthefuck whatthefuck!!!!</i>),,False,5
natsuki,0-10,female_crotch_will_be_visible,"target=monika,alsoPlaying=sayori,alsoPlayingSaidMarker=affections-glitch",tsun,"(<i>Oh! Monika's coldness must have hurt Sayori's feelings! D-don't gloat, Monika! Sayori deserves better!</i>)",,False,7
natsuki,0-10,female_masturbating,"notSaidMarker=sayonika,target=monika,targetSaidMarker=joint-masturbation",woah,"Huh?? Sayori, where'd you get that rope!?",sayonika,False,9
natsuki,0-10,female_masturbating,"target=monika,targetSaidMarker=joint-masturbation",isthatapenis,(<i>J-just as suprising... Sayori's the seme!?!? What!?!?</i>),,False,9
natsuki,0-10,female_masturbating,"target=monika,targetSaidMarker=joint-masturbation",isthatapenis,(<i>Wh-who would have thought silly Sayori would be a dom??</i>),,False,9
natsuki,0-10,female_masturbating,"target=monika,targetSaidMarker=joint-masturbation",aroused,Th-that's so lewd...,,False,9
natsuki,0-10,female_masturbating,"target=monika,targetSaidMarker=joint-masturbation",aroused,(<i>Replace Monika with ~player~ and I'd be all over that...</i>),,False,9
natsuki,0-10,female_masturbating,"target=monika,targetSaidMarker=joint-masturbation",upset,(<i>I thought I knew Sayori better than anyone...</i>),,False,9
natsuki,0-10,female_masturbating,"target=monika,targetSaidMarker=joint-masturbation",aroused,(<i>D-does this mean ~player~ and Sayori aren't a thing?? Or are they... o-open...?</i>),,False,9
natsuki,0-10,female_masturbating,"target=monika,targetSaidMarker=joint-masturbation",embarrassed,W-watching friends do that is...,,False,9
natsuki,0-10,female_masturbating,"target=monika,targetSaidMarker=joint-masturbation",aroused,W-watching two girls is...,,False,9
natsuki,0-10,female_masturbating,"target=monika,targetSaidMarker=joint-masturbation",aroused,(<i>Being tied up would be...</i>),,False,9
natsuki,0-10,female_crotch_is_visible,target=monika,isthatapenis,"(<i>Ah! M-monika's acting cold, but she's striking a pose!! She's totally a seme!! The aloof senpai type!!</i>)",,False,8
natsuki,0-10,female_start_masturbating,target=monika,isthatapenis,"W-wait, what!? Th-this is... So lucid... I really am dreaming..!",,False,8
natsuki,0-10,female_start_masturbating,"targetSaidMarker=joint-masturbation,target=monika,notSaidMarker=sayonika",woah,"Huh?? Sayori, where'd you get that rope!?",,False,8
natsuki,0-10,female_removed_accessory,"target=monika,alsoPlaying=sayori,alsoPlayingSaidMarker=affections-glitch,targetStage=3",calm,Maybe Monika has a protein bar we can split? No?,,False,3
natsuki,0-10,female_removed_accessory,"targetStage=2,target=vriska,alsoPlaying=monika",woah,"Monika, did you bring us here to show off the other clubs or something? We could use a bigger budget.",theater_club,False,
natsuki,0-10,male_must_strip,"target=pit,alsoPlaying=monika,targetStage=0",woah,"Hey, Monika, since when did we have a Bible club?",,False,
natsuki,0-10,female_must_masturbate,"target=monika,saidMarker=1st_fap",smug,Ha! Not so perfect <i>now!</i>,,False,8
natsuki,0-10,female_medium_chest_is_visible,"target=monika,alsoPlaying=sayori",isthatapenis,(<i>Ah! D-does Monika like her back?? Nnnnnn!!</i>),,False,7
natsuki,0-10,female_removing_accessory,"target=monika,alsoPlaying=sayori,targetStage=2,alsoPlayingSaidMarker=affections-glitch",upset,"Oh no. Sayori, did you skip lunch too?",say-glitch,False,2
natsuki,0-10,female_removing_major,"target=monika,alsoPlaying=sayori,alsoPlayingSaidMarker=affections-glitch,targetStage=3",woah,"Huh...? S-sayori, you doing okay?",,False,3
natsuki,0-10,female_removing_major,"alsoPlayingSaidMarker=affections-glitch,target=monika,alsoPlaying=sayori,notSaidMarker=player_f,targetStage=4",isthatapenis,"(<i>W-wait a second... Is Sayori--? ~player~, is Sayori </i>gay??)",,False,4
natsuki,0-10,female_finished_masturbating,"target=kyu,alsoPlaying=monika",gross,"W-wait, you'll set me off too! ..................What.",,False,
natsuki,0-10,female_finished_masturbating,"targetSaidMarker=joint-masturbation,target=monika",laugh,S-sayori! You go girl!!,,False,10
natsuki,0-10,female_chest_will_be_visible,"target=kyu,alsoPlaying=monika",embarrassed,"Monika, could you hand me a protein bar or something? I feel like I've been seeing stuff all game.",,False,
natsuki,0-10,female_chest_will_be_visible,"target=monika,alsoPlaying=sayori,alsoPlayingSaidMarker=affections-glitch",boobenvy,(<i>I feel bad for Sayori. If Monika doesn't like girls then...</i>),,False,6
natsuki,7,female_must_strip,"targetStage=6,target=monika",gross,"Urp! Ghah! S-sorry, um, b-bad joke?? (<i>I'm so nauseous all of the sudden...</i>)",,False,6
natsuki,7,female_chest_will_be_visible,target=monika,fear,"H-huh? Oh no, it's Monika's--",,False,6
natsuki,7,good_hand,"alsoPlayingTimeInStage=0,alsoPlaying=monika,alsoPlayingStage=6",tsun,"(<i>Monika's pretty, smart, hard working... Give her a sense of humor and I wouldn't even compare...</i>)",,False,6
natsuki,7,bad_hand,"alsoPlayingTimeInStage=1,alsoPlaying=monika,alsoPlayingStage=6",tsun,(<i>Since when has Monika been interested in ~player~?</i>),,False,6
natsuki,9-10,female_must_strip,"target=monika,targetStage=0",tsun,"Jeez. Monika, you're amazing at <i>cards</i> too. I've already lost completely while you're...",,False,0
natsuki,9-10,female_medium_chest_is_visible,target=monika,tsun,(<i>D-damn it... B-but I'm already like this so... ~player~ is more interested in me right now!</i>),,False,7
natsuki,4-10,female_finished_masturbating,target=monika,fear,"H-hey, Monika, now that you're done, I don't suppose you mind, nn-- just, stopping whatever weirdness you're causing?",,False,10
natsuki,4-8,good_hand,"alsoPlayingStage=1,alsoPlaying=monika,alsoPlayingTimeInStage=0",upset,Monika's just as good at cards as she is at everything else...,,False,1
natsuki,4-8,okay_hand,"alsoPlayingStage=1,alsoPlaying=monika,alsoPlayingTimeInStage=0",tsun,Monika's just as good at cards as she is at everything else...,,False,1
natsuki,4-8,okay_hand,"alsoPlayingTimeInStage=0,alsoPlaying=monika,alsoPlayingStage=3",fear,"I didn't imagine that, right ~player~? Monika's jacket and cardigan just... But that's stupid! They couldn't have just <i>vanished</i>!",,False,3
natsuki,4-5,bad_hand,"alsoPlayingStage=1,alsoPlaying=monika,alsoPlayingTimeInStage=0",aroused,Monika's just as good at cards as she is at everything else...,,False,1
natsuki,8,good_hand,"alsoPlayingTimeInStage=1,alsoPlaying=monika,alsoPlayingStage=6",tsun,(<i>Since when has Monika been interested in ~player~?</i>),,False,6
natsuki,0-8,good_hand,"alsoPlayingSaidMarker=joint-masturbation,alsoPlaying=monika",isthatapenis,Th-they're doing it! Right in front of us!,,False,
natsuki,0-8,good_hand,"alsoPlayingTimeInStage=0,alsoPlaying=monika,alsoPlayingStage=2",upset,(<i>Why'd I call Monika a slut? I'm such an asshole...</i>),,False,2
natsuki,0-8,good_hand,"alsoPlayingStage=3,alsoPlaying=monika,alsoPlayingTimeInStage=0",woah,"I didn't imagine that, right ~player~? Monika's jacket and cardigan just... but that's stupid! They couldn't have just <i>vanished</i>!",,False,3
natsuki,0-8,good_hand,"alsoPlaying=monika,saidMarker=say-glitch,alsoPlayingTimeInStage=0,alsoPlayingStage=3",woah,"W-wait, did Monika take off her cardigan AND her jacket? I wasn't paying attention...",,False,3
natsuki,0-8,good_hand,"alsoPlayingStage=4,alsoPlaying=monika,alsoPlayingTimeInStage=0",tsun,(<i>Does she like ~player~..? Wh-what do I care!? It's not like ~player~ belongs to me or anything...</i>),,False,4
natsuki,0-8,good_hand,"alsoPlayingStage=4,alsoPlaying=monika,saidMarker=say-glitch,alsoPlayingTimeInStage=0",embarrassed,"(<i>Sayori looks like Minori  in Parfeit Girls, wh-when she's around Spicy Gluten...</i>)",,False,4
natsuki,0-8,good_hand,"alsoPlayingStage=5,alsoPlaying=monika,alsoPlayingTimeInStage=0",upset,"(<i>Damn it, now I'm even being a bitch to ~player~... I'm the worst...</i>)",,False,5
natsuki,0-8,good_hand,"alsoPlaying=monika,saidMarker=say-glitch,alsoPlayingTimeInStage=0,alsoPlayingStage=5",isthatapenis,"(<i>S-so that's why she and ~player~ are--!! Fuuuuuck! Of course she is!! She's bi, at the very least! She talks about boys!</i>)",,False,5
natsuki,0-8,good_hand,"alsoPlaying=monika,saidMarker=say-glitch,notSaidMarker=player_f,alsoPlayingTimeInStage=0,alsoPlayingStage=5",isthatapenis,(<i>B-but what about ~player~?? She likes </i>him<i> right?? S-so she's bi??</i>),,False,5
natsuki,0-8,good_hand,"alsoPlaying=monika,saidMarker=say-glitch,alsoPlayingStage=5,alsoPlayingTimeInStage=1",aroused,(<i>Sayori's bi. How has this never come up?? Oh my god!!</i>),,False,5
natsuki,0-8,good_hand,"alsoPlaying=monika,alsoPlayingStage=6,saidMarker=say-glitch,alsoPlayingTimeInStage=0",isthatapenis,(<i>W-wait. And Monika's flirting with ~player~? I-it's a love triangle!!</i>),,False,6
natsuki,0-8,good_hand,"alsoPlayingStage=7,alsoPlaying=monika,alsoPlayingTimeInStage=0",embarrassed,"(<i>This has got to be some sort of dream, right?</i>)",,False,7
natsuki,0-8,good_hand,"totalRounds=10,alsoPlaying=monika",tsun,"You know, Monika, how come I never see you outside of Literature Club? We're in the same year.",,False,
natsuki,0-8,good_hand,"totalRounds=15,alsoPlaying=monika",fear,"Whoa, I'm so... I'm kinda dizzy. One sec...",,False,
natsuki,0-8,good_hand,"alsoPlaying=monika,totalRounds=20",aroused,This is such a weird dream...,,False,
natsuki,0-8,okay_hand,"alsoPlayingSaidMarker=joint-masturbation,alsoPlaying=monika",isthatapenis,Th-they're doing it! Right in front of us!,,False,
natsuki,0-8,okay_hand,"alsoPlayingTimeInStage=0,alsoPlaying=monika,alsoPlayingStage=2",upset,(<i>Why'd I call Monika a slut? I'm such an asshole...</i>),,False,2
natsuki,0-8,okay_hand,"alsoPlaying=monika,saidMarker=say-glitch,alsoPlayingTimeInStage=0,alsoPlayingStage=3",woah,"W-wait, did Monika take off her cardigan AND her jacket? I wasn't paying attention...",,False,3
natsuki,0-8,okay_hand,"alsoPlayingStage=4,alsoPlaying=monika,alsoPlayingTimeInStage=0",tsun,(<i>Does she like ~player~..? Wh-what do I care!? It's not like ~player~ belongs to me or anything...</i>),,False,4
natsuki,0-8,okay_hand,"alsoPlayingStage=4,alsoPlaying=monika,saidMarker=say-glitch,alsoPlayingTimeInStage=0",embarrassed,"(<i>Sayori looks like Minori  in Parfeit Girls, wh-when she's around Spicy Gluten...</i>)",,False,4
