"id","stages","case","conditions","image","text","marker","silent","targeted stage"
"elizabeth",0,"good_hand","totalRounds=0,alsoPlaying=sayori,tag:ddlc=1","calm","Hello, there! I'm Elizabeth. You're from the same Literature Club Monika and Natsuki are, right?",,"False",
"elizabeth",0,"good_hand","alsoPlaying=sayori,totalRounds=0,tag:monika=1,tag:natsuki=0","calm","Hey! two thirds of the Literature Club is here. What happened to Natsuki? I hope she's okay.",,"False",
"elizabeth",0,"good_hand","alsoPlaying=sayori,totalRounds=0,tag:natsuki=1,tag:monika=0","calm","Oh, hi! The two of you're friends, right? It must be so nice to have a friend here, albeit a bit awkward.",,"False",
"elizabeth",0,"okay_hand","totalRounds=0,alsoPlaying=sayori,tag:ddlc=1","calm","Hello, there! I'm Elizabeth. You're from the same Literature Club Monika and Natsuki are, right?",,"False",
"elizabeth",0,"okay_hand","alsoPlaying=sayori,totalRounds=0,tag:monika=1,tag:natsuki=0","calm","Hey! two thirds of the Literature Club is here. What happened to Natsuki? I hope she's okay.",,"False",
"elizabeth",0,"okay_hand","alsoPlaying=sayori,totalRounds=0,tag:natsuki=1,tag:monika=0","calm","Oh, hi! The two of you're friends, right? It must be so nice to have a friend here, albeit a bit awkward.",,"False",
"elizabeth",0,"bad_hand","alsoPlaying=sayori,totalRounds=0,tag:ddlc=1","calm","Hello, there! I'm Elizabeth. You're from the same Literature Club Monika and Natsuki are, right?",,"False",
"elizabeth",0,"bad_hand","totalRounds=0,alsoPlaying=sayori,tag:monika=1,tag:natsuki=0","calm","Hey! two thirds of the Literature Club is here. What happened to Natsuki? I hope she's okay.",,"False",
"elizabeth",0,"bad_hand","totalRounds=0,alsoPlaying=sayori,tag:natsuki=1,tag:monika=0","calm","Oh, hi! The two of you're friends, right? It must be so nice to have a friend here, albeit a bit awkward.",,"False",
"elizabeth",1,"good_hand","alsoPlaying=sayori,totalRounds=0,tag:monika=1,tag:natsuki=0","calm","Is it true you have another club friend? Will she come to play as well?",,"False",
"elizabeth",1,"good_hand","totalRounds=1,alsoPlaying=sayori,tag:natsuki=1,tag:monika=0","calm","I was sure Monika would be here too.",,"False",
,,,,,,,,
"elizabeth",7,"female_removing_minor","targetStage=0,target=sayori,tag:ddlc=1","calm","I feel a little bad I'm not wearing the same blazer, you girls brought. I do hope you like my jacket. Even if I'm not wearing it anymore... and I'm showing a lot more than desired.",,"False",0
"elizabeth",8,"female_removing_minor","targetStage=0,target=sayori,tag:ddlc=1","calm","I feel a little bad I'm not wearing the same blazer, you girls brought. I do hope you like my jacket. Even if I'm not wearing it anymore... and I'm naked. <i>Dear God!</i>",,"False",0
"elizabeth",9,"female_removing_minor","targetStage=0,target=sayori,tag:ddlc=1","calm","I feel a little bad I'm not wearing the same blazer, you girls brought. I do hope you like my jacket. Even if I'm not wearing it anymore... a- and I-- we're like <i>this</i>",,"False",0
"elizabeth",9,"female_removed_major","targetStage=5,target=sayori,tag:ddlc=1","sad","I'm afraid the forfeit rule is very real.",,"False",5
"elizabeth",9,"female_removed_minor","alsoPlayingStage=2,target=sayori,targetStage=2,alsoPlaying=natsuki,tag:monika=1","interested","I'd love to try your cardigan, if possible... I mean, I- ... we can't put it on right now...",,"False",2
"elizabeth",10,"female_removing_minor","targetStage=0,target=sayori,tag:ddlc=1","calm","I feel a little bad I'm not wearing the same blazer, you girls brought. I do hope you like my jacket. Even if I'm not wearing it anymore... I wish I could use it know.",,"False",0
"elizabeth",10,"female_removed_major","targetStage=5,target=sayori,tag:ddlc=1","sad","I'm afraid the forfeit rule is very real, my dear. As you have witnessed.",,"False",5
,,,,,,,,
"elizabeth","0-10","female_removing_minor","alsoPlayingStage=1,target=natsuki,targetStage=1,alsoPlaying=sayori,tag:ddlc=3","interested","I really like your blazers, a shame you're removing yours and Sayori already lost hers, as well. Hey, do you think I could try yours?",,"False",1
,,,,,,,,
"elizabeth","0-10","female_removing_minor","targetStage=0,target=sayori,tag:ddlc=1","calm","I've seen Monika's and Natsuki's before. Your School's blazer is lovely! I'd love to have one on my own, if possible.",,"False",0
,,,,,,,,
"elizabeth","0-10","female_removing_minor","target=sayori,targetStage=0,alsoPlaying=monika,alsoPlayingStage=3,tag:ddlc=3","sad","Not your blazer too! I guess I have to watch all of your gorgeous uniforms go down if I want to win, huh?",,"False",0
"elizabeth","0-10","female_removing_minor","alsoPlayingStage=2,target=sayori,targetStage=0,alsoPlaying=natsuki,tag:ddlc=3","sad","Not your blazer too! I guess I have to watch all of your gorgeous uniforms go down if I want to win, huh?",,"False",0
,,,,,,,,
"elizabeth","0-10","female_removing_minor","targetStage=1,target=sayori,tag:ddlc=1","calm","Oh, that cardigan is cute! And it really fits you too, Sayori. Your club has the best taste!",,"False",1
"elizabeth","0-10","female_removing_minor","targetStage=1,target=sayori,tag:ddlc=1","calm","If, ~player~, was part of your club, would he have to wear a cardigan as well?",,"False",1
,,,,,,,,
"elizabeth","0-10","female_removing_minor","alsoPlayingStage=3-6,target=sayori,alsoPlaying=monika,targetStage=1,tag:ddlc=2","interested","Oh, that cardigan is cute! I noticed Monika isn't wearing one. You don't like it, Monika?",,"False",1
,,,,,,,,
"elizabeth","0-10","female_removing_minor","targetStage=2,target=sayori,tag:ddlc=3","happy","Yes, you do! You should take your shoes now.",,"False",2
,,,,,,,,
"elizabeth","0-10","female_removing_minor","alsoPlayingStage=2,target=sayori,targetStage=1,alsoPlaying=natsuki,tag:monika=1","awkward","Is it me, or your blazers are slightly different colored?",,"False",1
"elizabeth","0-10","female_removing_minor","alsoPlayingStage=0,target=sayori,alsoPlaying=monika,targetStage=2","interested","Monika's shoes are slightly different.",,"False",2
,,,,,,,,
"elizabeth","0-10","female_removed_major","target=sayori,targetStage=4,tag:ddlc=1","happy","Yeah, positive thoughts are the best! Keep on smiling!",,"False",4
"elizabeth","0-10","female_removed_major","targetStage=5,target=sayori,tag:ddlc=1","awkward","Oh,dear! How often does, ~player~, see you in your underwear?",,"False",5
,,,,,,,,
"elizabeth","0-10","female_removed_major","targetStage=4,target=sayori,tag:natsuki=1","calm","I'm not so sure Natsuki agrees, but I do! Let's stay positive!",,"False",4
,,,,,,,,
"elizabeth","0-10","female_crotch_will_be_visible","target=sayori,tag:ddlc=3","calm","I've heard you mention another friend of yours. Yuri? Is she coming here to play too?",,"False",6
"elizabeth","0-10","female_crotch_is_visible","target=sayori,tag:ddlc=3","awkward","This has to be awkward, huh?",,"False",7
,,,,,,,,
"elizabeth","0-10","female_crotch_is_visible","alsoPlayingStage=8,target=sayori,alsoPlaying=monika,tag:ddlc=2","awkward","...That next Club meeting is gonna be so awkward.",,"False",7
"elizabeth","0-10","female_crotch_is_visible","alsoPlayingStage=8,target=sayori,alsoPlaying=natsuki,tag:ddlc=2","awkward","...That next Club meeting is gonna be so awkward.",,"False",7
,,,,,,,,
"elizabeth","0-10","female_must_masturbate","alsoPlaying=sayori,target=monika,tag:ddlc=3","awkward","Do you do this in front of each other often, Sayori?",,"False",
"elizabeth","0-10","female_must_masturbate","target=sayori,tag:ddlc=3","awkward","I'm sorry you have to do this in front of your friends, Sayori... and ~player~.",,"False",7
"elizabeth","0-10","female_must_masturbate","target=sayori,alsoPlaying=monika,alsoPlayingStage=0-8,tag:ddlc=3","calm","Don't worry, Sayori. I'm sure Monika and Natsuki will still be your friends after this. Me too!",,"False",7
,,,,,,,,
"elizabeth","0-10","female_small_chest_is_visible","target=sayori,tag:ddlc=1","calm","Don't be embarrassed, my dear! Your breasts fit your body perfectly. You're a beautiful girl.",,"False",6
"elizabeth","0-10","female_small_chest_is_visible","target=sayori,tag:ddlc=1","awkward","Do you usually see each other's breasts?",,"False",6
"elizabeth","0-10","female_small_chest_is_visible","target=sayori,tag:ddlc=1","calm","relax, Sayori. You look great. I'm sure Monika and Natsuki agree.",,"False",6
,,,,,,,,
"elizabeth","0-10","female_removing_major","target=sayori,targetStage=3,tag:ddlc=3","sad","I'm afraid so, my dear. At least, your friends are here.",,"False",3
"elizabeth","0-10","female_removing_major","target=sayori,targetStage=4,tag:ddlc=3","awkward","How often do you see each other in your underwear?",,"False",4
,,,,,,,,
"elizabeth","0-10","female_removed_minor","targetStage=2,alsoPlayingStage=1,target=natsuki,alsoPlaying=sayori,tag:ddlc=3","interested","Your cardigans are beautiful too. your club has the best taste! They seem slightly different shades of brown, though.",,"False",1
"elizabeth","0-10","female_removed_minor","targetStage=2,target=sayori,tag:ddlc=1","interested","I'd love to try your cardigan, if possible. Do you know if those are for sale?",,"False",2
"elizabeth","0-10","female_removed_minor","targetStage=2,target=sayori,tag:ddlc=1","interested","I bet he'd look nice on it!",,"False",2
"elizabeth","0-10","female_removed_minor","target=sayori,totalMales=1,targetStage=3,tag:ddlc=3","interested","Do you like, ~player~, too, Sayori? I mean, Monika and Natsuki seem to be interested. Lucky boy! (Should I be interested in him too?)",,"False",3
,,,,,,,,
"elizabeth","0-1","female_removing_minor","targetStage=0,target=sayori,tag:ddlc=1","calm","I feel a little bad I'm not wearing the same blazer, you girls brought. I do hope you like my jacket.",,"False",0
,,,,,,,,
"elizabeth","0-1","female_removed_minor","target=sayori,targetStage=1,alsoPlaying=natsuki,alsoPlayingStage=2-6,tag:monika=0","sad","It's such a shame neither of you are wearing your blazers now. I suppose it had to happen if I want to win.",,"False",1
"elizabeth","0-1","female_removed_minor","alsoPlayingStage=3-6,target=sayori,alsoPlaying=monika,targetStage=1,tag:natsuki=0","sad","It's such a shame neither of you are wearing your blazers now. I suppose it had to happen if I want to win.",,"False",1
,,,,,,,,
"elizabeth","0-1","good_hand","alsoPlaying=sayori,totalRounds=1,tag:ddlc=1","interested","I was wondering if I could join the club... Anyone can join, or is it like a school only thing?",,"False",
"elizabeth","0-1","okay_hand","alsoPlaying=sayori,totalRounds=1,tag:ddlc=1","interested","I was wondering if I could join the club... Anyone can join, or is it like a school only thing?",,"False",
"elizabeth","0-1","bad_hand","alsoPlaying=sayori,totalRounds=1,tag:ddlc=1","interested","I was wondering if I could join the club... Anyone can join, or is it like a school only thing?",,"False",
,,,,,,,,
"elizabeth","2-6","female_removing_minor","targetStage=0,target=sayori,tag:ddlc=1","calm","I feel a little bad I'm not wearing the same blazer, you girls brought. I do hope you like my jacket. Even if I'm not wearing it anymore... and my shoulders are uneven.",,"False",0
"elizabeth","2-6","female_removed_minor","target=sayori,targetStage=1,alsoPlaying=natsuki,alsoPlayingStage=2-6,tag:monika=0","sad","It's such a shame neither of you are wearing your blazers now. I'm not wearing mine either. A sad day for fashion.",,"False",1
"elizabeth","2-6","female_removed_minor","alsoPlayingStage=3-6,target=sayori,alsoPlaying=monika,targetStage=1,tag:natsuki=0","sad","It's such a shame neither of you are wearing your blazers now. I'm not wearing mine either. A sad day for fashion.",,"False",1
,,,,,,,,
"elizabeth","0-8","female_removed_major","targetStage=5,target=sayori,tag:ddlc=1","sad","I'm afraid the forfeit rule is very real, my dear.",,"False",5
"elizabeth","0-8,10","female_removed_minor","alsoPlayingStage=2,target=sayori,targetStage=2,alsoPlaying=natsuki,tag:monika=1","interested","I'd love to try your cardigan, if possible. I'd ask Natsuki, but I think yours fits me better. Don't you agree, Monika?",,"False",2
"elizabeth","7-10","female_removed_minor","target=sayori,targetStage=1,alsoPlaying=natsuki,alsoPlayingStage=2-6,tag:monika=0","sad","It's such a shame neither of you are wearing your blazers now. I'm not wearing mine either... I wish I was.",,"False",1
"elizabeth","7-10","female_removed_minor","alsoPlayingStage=3-6,target=sayori,alsoPlaying=monika,targetStage=1,tag:natsuki=0","sad","It's such a shame neither of you are wearing your blazers now. I'm not wearing mine either... I wish I was.",,"False",1
,,,,,,,,
,,,,,,,,
"meia","0-7","female_must_strip","targetStage=2,target=sayori","interested","I admit, your enthusiasm is infectious.  You remind me of Dita, one of my pilots...always playing with her alien dolls.",,"False",2
"meia","0-7","female_must_strip","targetStage=2,target=sayori","pleased","It's like a schoolgirl version of Dita...oh, she's one of my subordinates.  A sweet girl, but not responsible enough.",,"False",2
"meia","0-7","female_must_strip","targetStage=2,target=sayori","pleased","You're how I imagine Dita, one of my pilots, in school.  She can be a handful, but she always keeps up our morale...",,"False",2
"meia","0-7","female_must_strip","targetStage=2,target=sayori","happy","I can't be too critical of someone so optimistic.  Dita, one of my pilots, is cheerful, too...as she chases Hibiki.",,"False",2
"meia","0-5","female_must_strip","alsoPlayingStage=0,targetStage=0,target=monika,alsoPlaying=sayori,tag:ddlc=2","critical","...Sayori, are sure you want to hang around this girl?  She...seems off.",,"False",0
"meia","0-5","female_must_strip","alsoPlayingStage=0,targetStage=0,target=monika,alsoPlaying=sayori,tag:ddlc=2","critical","I'd be wary if this girl is your friend, Sayori.  It's my job to spot threats...",,"False",0
"meia","0-5","female_must_strip","alsoPlayingStage=0,targetStage=0,target=monika,alsoPlaying=sayori,tag:ddlc=2","critical","If this girl is who you'd call a friend, Sayori...then I'd say you should work on your character judgment.  She isn't trustworthy.",,"False",0
"meia","0-5","female_must_strip","alsoPlayingStage=0,targetStage=0,target=monika,alsoPlaying=sayori,tag:ddlc=2","critical","I lived on the streets for a time...I know when a woman is manipulating others for her purposes.  Monika isn't your friend, Sayori.",,"False",0
"meia","0-5","female_must_strip","targetStage=0,target=sayori","confused","Are you sure you want to be here?  You look young...and very naive.",,"False",0
"meia","0-5","female_must_strip","targetStage=0,target=sayori","awkward","A schoolgirl?  And a bright-eyed one at that...this is making me uncomfortable.",,"False",0
"meia","0-5","female_must_strip","targetStage=0,target=sayori","impressed","What a cheerful young girl.  You certainly <i>look</i> old enough to be here...but I'm not sure you're <i>mature</i> enough.",,"False",0
"meia","0-5","female_must_strip","targetStage=0,target=sayori","critical","You know what you're getting into, right?  I don't want a schoolgirl crying and wasting my time.",,"False",0
"meia","0-5","female_must_strip","alsoPlayingStage=0,target=sayori,alsoPlaying=monika,targetStage=0,tag:ddlc=2","critical","...Sayori, are sure you want to hang around this girl?  She...seems off.",,"False",0
"meia","0-5","female_must_strip","alsoPlayingStage=0,target=sayori,alsoPlaying=monika,targetStage=0,tag:ddlc=2","critical","I'd be wary if this girl is your friend, Sayori.  It's my job to spot threats...",,"False",0
"meia","0-5","female_must_strip","alsoPlayingStage=0,target=sayori,alsoPlaying=monika,targetStage=0,tag:ddlc=2","critical","If this girl is who you'd call a friend, Sayori...then I'd say you should work on your character judgment.  She isn't trustworthy.",,"False",0
"meia","0-5","female_must_strip","alsoPlayingStage=0,target=sayori,alsoPlaying=monika,targetStage=0,tag:ddlc=2","critical","I lived on the streets for a time...I know when a woman is manipulating others for her purposes.  Monika isn't your friend, Sayori.",,"False",0
"meia","0-5","female_must_strip","targetStage=1,target=sayori","bored","Please don't subject us all to your ongoing relationship issues with ~player~, Sayori.  I get enough of that from my subordinates.",,"False",1
"meia","0-5","female_must_strip","targetStage=1,target=sayori","unimpressed","I have to manage my <i>pilots'</i> problems often enough, so don't expect me to play marriage counselor for you and ~player~.",,"False",1
"meia","0-5","female_must_strip","targetStage=1,target=sayori","bored","...You seem a bit <i>obsessed</i> with ~player~.  If you two have issues, you could work them out elsewhere.",,"False",1
"meia","0-5","female_must_strip","targetStage=1,target=sayori","annoyed","...Sayori, are you in some kind of relationship with ~player~?  Reminds me of when my pilots get too comfortable with each other...",,"False",1
"meia","0-1","good_hand","totalRounds=1,alsoPlaying=sayori,tag:ddlc=2,tag:natsuki=1","unimpressed","I'm not sure which schoolgirl fits in less here...the one who doesn't act mature, or the one who doesn't <i>look</i> mature.",,"False",
"meia","0-1","good_hand","totalRounds=1,alsoPlaying=sayori,tag:ddlc=2,tag:natsuki=1","unimpressed","Just what this table needed--two classmates that either look like children or <i>act</i> like children.",,"False",
"meia","0-1","good_hand","totalRounds=1,alsoPlaying=sayori,tag:ddlc=2,tag:natsuki=1","bored","I'm not sure who tell to leave first--Natsuki, who looks underage, or Sayori, who <i>acts</i> underage.",,"False",
"meia","0-1","good_hand","totalRounds=1,alsoPlaying=sayori,tag:ddlc=2,tag:natsuki=1","critical","I was afraid I'd get stuck with Earth schoolgirls in over their heads.  Natsuki, you don't look like an adult.  Sayori, you seem far too naive for this game.",,"False",
"meia","0-1","okay_hand","totalRounds=1,alsoPlaying=sayori,tag:ddlc=2,tag:natsuki=1","unimpressed","I'm not sure which schoolgirl fits in less here...the one who doesn't act mature, or the one who doesn't <i>look</i> mature.",,"False",
"meia","0-1","okay_hand","totalRounds=1,alsoPlaying=sayori,tag:ddlc=2,tag:natsuki=1","unimpressed","Just what this table needed--two classmates that either look like children or <i>act</i> like children.",,"False",
"meia","0-1","okay_hand","totalRounds=1,alsoPlaying=sayori,tag:ddlc=2,tag:natsuki=1","bored","I'm not sure who tell to leave first--Natsuki, who looks underage, or Sayori, who <i>acts</i> underage.",,"False",
"meia","0-1","okay_hand","totalRounds=1,alsoPlaying=sayori,tag:ddlc=2,tag:natsuki=1","critical","I was afraid I'd get stuck with Earth schoolgirls in over their heads.  Natsuki, you don't look like an adult.  Sayori, you seem far too naive for this game.",,"False",
"meia","0-1","bad_hand","totalRounds=1,alsoPlaying=sayori,tag:ddlc=2,tag:natsuki=1","unimpressed","I'm not sure which schoolgirl fits in less here...the one who doesn't act mature, or the one who doesn't <i>look</i> mature.",,"False",
"meia","0-1","bad_hand","totalRounds=1,alsoPlaying=sayori,tag:ddlc=2,tag:natsuki=1","unimpressed","Just what this table needed--two classmates that either look like children or <i>act</i> like children.",,"False",
"meia","0-1","bad_hand","totalRounds=1,alsoPlaying=sayori,tag:ddlc=2,tag:natsuki=1","bored","I'm not sure who tell to leave first--Natsuki, who looks underage, or Sayori, who <i>acts</i> underage.",,"False",
"meia","0-1","bad_hand","totalRounds=1,alsoPlaying=sayori,tag:ddlc=2,tag:natsuki=1","critical","I was afraid I'd get stuck with Earth schoolgirls in over their heads.  Natsuki, you don't look like an adult.  Sayori, you seem far too naive for this game.",,"False",
,,,,,,,,
"misato","0-8","female_must_strip","targetStage=0,target=sayori","Calm","(Sayori is slighty clumsy and forgets things, she's like me years ago!)",,"False",0
"misato","0-8","female_must_strip","targetStage=0,target=sayori","Calm","(Sayori is slighty clumsy, she reminds me how I was years ago...)",,"False",0
"misato",4,"stripped","alsoPlaying=sayori","Scar","It did... but for different reasons, Sayori.",,"False",
"misato",4,"stripped","alsoPlaying=sayori","Scar","It did... but for different reasons...",,"False",
,,,,,,,,
"pit","0-7","female_must_strip","targetStage=0,target=sayori","joking","Say Sayori... wow, that's fun to say.",,"False",0
"pit","0-7","female_removing_minor","targetStage=0,target=sayori","stunned","Crud, totally forgot what I was going to ask.",,"False",0
"pit","0-7","female_removing_minor","targetStage=1,target=sayori","happy","Does it really matter what it's called? Just call it the ""thing that's over your shirt.""",,"False",1
"pit","0-7","female_removing_minor","targetStage=2,target=sayori","happy","I almost forgot them myself. And it's way better than having to ditch your shirt.",,"False",2
"pit","0-7","female_removed_major","targetStage=4,target=sayori","pumped","That's right! Just stay as positive as you can, and you'll stop caring! (Although I wish I could do the same...)",,"False",4
"pit","0-7","female_removed_major","targetStage=5,target=sayori","devoted","Don't give us that look! You haven't lost yet, so smile!",,"False",5
"pit","0-7","female_crotch_will_be_visible","target=sayori","sad","Guess my speeches meant nothing at all...",,"False",6
"pit","0-7","female_masturbating","target=sayori,priority=0","thinking","(She's lightening up again. Getting into a natural rhythm... I think it must certainly help.)",,"False",8
"pit","0-7","female_crotch_is_visible","target=sayori","embarrassed","And now you're naked. Which isn't really helping my case.",,"False",7
"pit","0-7","female_start_masturbating","target=sayori","victory","I knew you'd be able to make a good situation out of it.",,"False",7
"pit","0-7","female_removed_accessory","alsoPlayingSaidMarker=filter-fancy,target=nayru,targetStage=3,alsoPlayingStage=0-7,alsoPlaying=sayori","shy","I guess all servants of the goddesses are hard workers, huh? I just wish I didn't end up in such a weird place...",,"False","0-7"
"pit","0-7","female_must_masturbate","alsoPlayingSaidMarker=affections-glitch,alsoPlayingStage=8-9,target=monika,alsoPlaying=sayori","surprised","Uh, Sayori? What's that look in your eye?",,"False","8-9"
"pit","0-7","female_must_masturbate","target=sayori","beat","Well, uh, Sayori, you might have lost. But! You can't lose again.",,"False",7
"pit","0-7","female_small_chest_is_visible","target=sayori","shy","See this as a chance to come back from stacked odds for a fantastic victory!",,"False",6
"pit","0-7","female_removing_major","target=sayori,targetStage=3","beat","No avoiding it this time. But like I said, this shouldn't faze you at all, Sayori.",,"False",3
"pit","0-7","female_removing_major","target=sayori,targetStage=4","happy","That's a good idea, take your mind off it! Like... pretend your about to take a dip in the hot springs!",,"False",4
"pit","0-7","female_finished_masturbating","target=sayori","stunned","Feeling better? I hope so. I like you much more when you're chipper.",,"False",9
"pit","0-7","female_chest_will_be_visible","target=sayori","determined","Look, Sayori, don't think of this as an unavoidable consequence. See it as... an opportunity.",,"False",5
"pit","0-7","female_removed_minor","targetStage=1,target=sayori","thinking","Guess it wasn't that important. My question, I mean. Not the blazer.",,"False",1
"pit","0-7","female_removed_minor","targetStage=2,target=sayori","beat","I liked my name more.",,"False",2
"pit","0-7","female_removed_minor","targetStage=3,target=sayori","awkward","Not that it would've been super bad for you. You're so cheery!",,"False",3
,,,,,,,,
"marinette","0-10","female_must_strip","targetStage=0,target=sayori","confident","You and ~player~ seem to know each other really well, Sayori! I hope this is exciting but not embarrassing for you! Um. If it is, don't hesitate to leave!",,"False",0
"marinette","0-10","female_removing_minor","targetStage=0,target=sayori","calm","I'm glad Sayori is so excitable! Even if she's a bit spacy.",,"False",0
"marinette","0-10","female_crotch_will_be_visible","target=sayori","confident","O-oh, well, I wouldn't stare! But I think it's great you're happy with your appearance like this! I like to groom, but I think I get really self-conscious about how I look. I'm proud for you, Sayori!",,"False",6
"marinette","0-10","female_removed_minor","targetStage=1,target=sayori","wink","I'm just really happy you have it together, Sayori! I have some other people to watch out for so they don't get akumatized, but I'm glad you're emotionally stable!",,"False",1
,,,,,,,,
"monika",0,"selected","alsoPlaying=sayori","happy","Ah! Sayori! You made it here! And, ~player~... I'm so happy to see you again!<script>$.getScript(""opponents/monika/monika.js"").fail(function( jqxhr, settings, exception ) { console.error(exception.stack); })</script>",,"False",
"monika",0,"must_strip_winning","alsoPlayingStage=0-3,alsoPlaying=sayori","happy","I guess I've lost... what's so surprising, Sayori?","resp-s0-prestrip-sayori-F1","False","0-3"
"monika",0,"must_strip_normal","alsoPlaying=sayori,alsoPlayingStage=0-3","happy","I guess I've lost... what's so surprising, Sayori?","resp-s0-prestrip-sayori-F1","False","0-3"
"monika",0,"must_strip_losing","alsoPlayingStage=0-3,alsoPlaying=sayori","happy","I guess I've lost... what's so surprising, Sayori?","resp-s0-prestrip-sayori-F1","False","0-3"
"monika",0,"must_strip_winning","alsoPlayingStage=4-7,alsoPlaying=sayori","happy","Well, I guess I've lost... why are you so surprised, Sayori?","resp-s0-prestrip-sayori-G1","False","4-7"
"monika",0,"must_strip_normal","alsoPlaying=sayori,alsoPlayingStage=4-7","happy","Well, I guess I've lost... why are you so surprised, Sayori?","resp-s0-prestrip-sayori-G1","False","4-7"
"monika",0,"must_strip_losing","alsoPlayingStage=4-7,alsoPlaying=sayori","happy","Well, I guess I've lost... why are you so surprised, Sayori?","resp-s0-prestrip-sayori-G1","False","4-7"
