"id","stages","case","conditions","image","text","marker","silent","targeted stage"
"mahiru","0-9","female_removed_minor","targetStage=1,target=sayori","embarrassed","You can put it on again! ...After the game.",,"False",1
"mahiru","0-9","female_removed_minor","targetStage=2,target=sayori","exasperated","Now you're just making this more confusing...",,"False",2
"mahiru","0-9","female_removed_minor","targetStage=3,target=sayori","excited","Haha. Bit close for comfort there, right Sayori?",,"False",3
,,,,,,,,
"ryuji","0-4","female_removed_minor","targetStage=2,target=sayori","awkward","I have no clue what it's called either.",,"False",2
"ryuji",4,"stripped","alsoPlayingSaidMarker=filter-aggressive,alsoPlayingStage=0-7,alsoPlaying=sayori","cocky","I'll take it as a compliment!",,"False","0-7"
"ryuji",4,"stripped","alsoPlayingSaidMarker=filter-aggressive,alsoPlayingStage=0-7,alsoPlaying=sayori","grumpy","I'm RIGHT HERE, you know.",,"False","0-7"
"ryuji",4,"stripped","alsoPlayingSaidMarker=filter-aggressive,alsoPlayingStage=0-7,alsoPlaying=sayori","fingerguns","That's me! Ryuji Sakamoto: asskicker extraordinaire!",,"False","0-7"
"ryuji",4,"stripped","alsoPlayingSaidMarker=filter-aggressive,alsoPlayingStage=0-7,alsoPlaying=sayori","allout","Well, I <i>do</i> kick ass and take names!",,"False","0-7"
"ryuji",4,"stripped","alsoPlayingSaidMarker=filter-aggressive,alsoPlayingStage=0-7,alsoPlaying=sayori","cocky","You think I'm intimidatin' now? Wait 'till you see me in my Phantom Thief garb. You'd probably piss yourself in fear.",,"False","0-7"
"ryuji",3,"stripped","alsoPlaying=sayori,tag:aggressive=1","cocky","Ya think I look scary? Good. I <i>want</i> people to take one good look at me and think 'Man, you shouldn't eff around with this guy!'",,"False",
"ryuji",3,"stripped","alsoPlaying=sayori,tag:aggressive=1","cocky","It's called embracin' the delinquent image! The skull of rebellion is my flag!","deliquentimage","False",
"ryuji",2,"stripped","alsoPlayingNotSaidMarker=filter-school_uniform,alsoPlayingStage=0-7,alsoPlaying=sayori","neutral","I graduated from Shujin Academy. Where you from?",,"False","0-7"
"ryuji",2,"stripped","alsoPlayingNotSaidMarker=filter-school_uniform,alsoPlayingStage=0-7,alsoPlaying=sayori","awkward","<i>A girl's never called me cute...</i>",,"False","0-7"
"ryuji",2,"stripped","alsoPlayingNotSaidMarker=filter-school_uniform,alsoPlayingStage=0-7,alsoPlaying=sayori","neutral","Oh! I just graduated from Shujin Academy!",,"False","0-7"
"ryuji","1-7","stripped","alsoPlayingNotSaidMarker=filter-athletic,alsoPlayingStage=0-7,alsoPlaying=sayori","cheerful","Hell yeah I do! I jog at least once a day.",,"False","0-7"
"ryuji","1-7","stripped","alsoPlayingNotSaidMarker=filter-athletic,alsoPlayingStage=0-7,alsoPlaying=sayori","cheerful","Oh yeah, I used to be an athlete.","athlete","False","0-7"
,,,,,,,,
"nayru",3,"stripped","alsoPlayingSaidMarker=filter-fancy,alsoPlayingStage=0-7,alsoPlaying=sayori","stripping","That's very sweet of you, Sayori. Really; even an oracle needs to unwind every now and again.",,"False","0-7"
,,,,,,,,
"natsuki","0-3","female_removing_minor","targetStage=0,target=sayori","embarrassed","O-oh. Okay. If you're fine with it then...",,"False",0
"natsuki","0-3","female_removing_minor","targetStage=0,target=sayori","embarrassed","Eh?? Y-you're okay with it? Th-then...",,"False",0
"natsuki","0-3","female_removed_minor","targetStage=1,target=sayori","smug","Then consider this as revenge for you eating my cookie the other day. It's just deserts.",,"False",1
"natsuki","0-3","female_removed_minor","targetStage=1,target=sayori","smug","Then I guess I can overlook how you ate my cookie earlier. Just deserts.",,"False",1
"natsuki",1,"stripping","alsoPlaying=sayori,alsoPlayingStage=8-9","zstrip","D-don't look at me like that Sayori! You can't guilt trip me!",,"False","8-9"
"natsuki",1,"stripping","alsoPlaying=sayori,alsoPlayingStage=8-9","zstrip","Just the blazer this time. And no puppy dog eyes, Sayori. It won't work!",,"False","8-9"
"natsuki",1,"stripped","alsoPlayingStage=8-9,alsoPlaying=sayori","aroused","Y-yeah, I'm joining you... B-but if I lose again, I still reserve the right to leave, okay?",,"False","8-9"
"natsuki","4-6","female_removing_minor","targetStage=0,alsoPlaying=sayori,notSaidMarker=say-green,alsoPlayingSaidMarker=filter-green_hair-1,filter=green_hair","embarrassed","Green as Yuri gets when literally anyone else talks to ~player~...","say-green","False",
"natsuki","4-6","male_removing_major","targetStage=0,notSaidMarker=say-green,alsoPlayingSaidMarker=filter-green_hair-1,filter=green_hair,alsoPlaying=sayori","embarrassed","Green as Yuri gets when literally anyone else talks to ~player~...","say-green","False",
"natsuki","4-6","male_removing_accessory","targetStage=0,notSaidMarker=say-green,alsoPlayingSaidMarker=filter-green_hair-1,filter=green_hair,alsoPlaying=sayori","embarrassed","Green as Yuri gets when literally anyone else talks to ~player~...","say-green","False",
"natsuki","4-6","female_removing_accessory","targetStage=0,notSaidMarker=say-green,alsoPlayingSaidMarker=filter-green_hair-1,filter=green_hair,alsoPlaying=sayori","embarrassed","Green as Yuri gets when literally anyone else talks to ~player~...","say-green","False",
"natsuki","4-6","female_removing_major","targetStage=0,notSaidMarker=say-green,alsoPlayingSaidMarker=filter-green_hair-1,filter=green_hair,alsoPlaying=sayori","boobenvy","Green as Yuri gets when literally anyone else talks to ~player~...","say-green","False",
"natsuki","4-6","male_removing_minor","targetStage=0,notSaidMarker=say-green,alsoPlayingSaidMarker=filter-green_hair-1,filter=green_hair,alsoPlaying=sayori","embarrassed","Green as Yuri gets when literally anyone else talks to ~player~...","say-green","False",
"natsuki","4-6","good_hand","saidMarker=tips,alsoPlaying=sayori,priority=0","tsun","(<i>Relationship advice: maybe only invite Sayori next time, asshole.</i>)",,"False",
"natsuki","4-6","good_hand","saidMarker=tips,alsoPlaying=sayori,priority=0","embarrassed","Winning isn't everything, ~player~. Maybe you should let Sayori and me win some?",,"False",
"natsuki","4-6","good_hand","saidMarker=tips,alsoPlaying=sayori,priority=0","upset","(<i>~player~, this is your chance to impress Sayori so...Don't waste it.</i>)",,"False",
"natsuki","4-6","good_hand","saidMarker=tips,alsoPlaying=sayori,priority=0","tsun","(<i>~player~, remember to make Sayori feel special.</i>)",,"False",
"natsuki","4-6","okay_hand","alsoPlaying=sayori,priority=0","upset","(<i>Sayori really likes ~player~. I can't just...</i>)",,"False",
"natsuki","4-6","okay_hand","alsoPlaying=sayori,priority=0","upset","(<i>If I lose, ~player~ will see... And Sayori likes ~player~, so... I'm an asshole even if I lose!</i>)",,"False",
"natsuki","4-6","okay_hand","alsoPlaying=sayori,priority=0","upset","(<i>Why am I even here. ~player~ and Sayori are basically insepreble. I'm just a third wheel...</i>)",,"False",
"natsuki","4-6","okay_hand","alsoPlaying=sayori,priority=0","upset","(<i>Sayori is my friend. And yet here I am staring at ~player~ because I'm full of shit.</i>)",,"False",
"natsuki","7-10","female_must_strip","targetStage=1,target=sayori","upset","Finally... How many casinos have you run out of business, Sayori?",,"False",1
"natsuki","7-10","female_must_strip","targetStage=5,target=sayori","isthatapenis","H-hey! I'm already--! It... It really isn't that bad, Sayori. Really. It even kinda...",,"False",5
"natsuki","7-10","female_must_strip","targetStage=5,target=sayori","isthatapenis","It isn't s-so bad, Sayori. I mean... Um, it even kinda...",,"False",5
"natsuki","7-10","female_removed_major","notSaidMarker=say-yuri-absent2,alsoPlayingSaidMarker=yuri-absent-2,alsoPlayingStage=0-7,alsoPlaying=sayori","embarrassed","It's perfect that Yuri isn't here! I'd be so embarrassed...","say-yuri-absent2","False","0-7"
"natsuki","7-10","male_removed_major","notSaidMarker=say-yuri-absent2,alsoPlayingSaidMarker=yuri-absent-2,alsoPlayingStage=0-7,alsoPlaying=sayori","embarrassed","It's perfect that Yuri isn't here! I'd be so embarrassed...","say-yuri-absent2","False","0-7"
"natsuki","7-10","female_masturbating","target=human,alsoPlaying=sayori","embarrassed","(<i>~player~, don't look at me, look at Sayori...</i>)",,"False",
"natsuki","7-10","female_masturbating","target=human,alsoPlaying=sayori","embarrassed","(<i>He's masturbating to sayori. He's masturbating to sayori. Not me. And that's a good thing.</i>)",,"False",
"natsuki","7-10","female_masturbating","target=human,alsoPlaying=sayori","isthatapenis","S-so that's what Sayori sees in you...",,"False",
"natsuki","7-10","female_masturbating","target=human,alsoPlaying=sayori","embarrassed","You could have just left, ~player~. No one's forcing you to...",,"False",
"natsuki","7-10","female_masturbating","target=human,alsoPlaying=sayori","embarrassed","(<i>~player~ looks so lonely... I could... No, S-sayori could...</i>)",,"False",
"natsuki","7-10","male_masturbating","alsoPlaying=sayori,target=human","embarrassed","(<i>~player~, don't look at me, look at Sayori...</i>)",,"False",
"natsuki","7-10","male_masturbating","alsoPlaying=sayori,target=human","embarrassed","(<i>He's masturbating to sayori. He's masturbating to sayori. Not me. And that's a good thing.</i>)",,"False",
"natsuki","7-10","male_masturbating","alsoPlaying=sayori,target=human","isthatapenis","S-so that's what Sayori sees in you...",,"False",
"natsuki","7-10","male_masturbating","alsoPlaying=sayori,target=human","embarrassed","You could have just left, ~player~. No one's forcing you to...",,"False",
"natsuki","7-10","male_masturbating","alsoPlaying=sayori,target=human","embarrassed","(<i>~player~ looks so lonely... I could... No, S-sayori could...</i>)",,"False",
"natsuki",9,"masturbating","notSaidMarker=nat_back_mast,alsoPlayingStage=7,alsoPlaying=sayori,alsoPlayingTimeInStage=0","upset","Okay, I'm back. (<i>I can't believe I walked out into the main room like this...</i>)","nat_back_mast","False",7
"natsuki",9,"masturbating","alsoPlaying=sayori,priority=0","aroused","(<i>M-maybe Sayori would share...</i>)",,"False",
"natsuki",9,"masturbating","alsoPlaying=sayori,priority=0","boobenvy","(<i>Don't masturbate to ~player~. Don't masturbate to ~player~.</i>)",,"False",
"natsuki",9,"masturbating","alsoPlaying=sayori,priority=0","embarrassed","(<i>Sayori and ~player~ haven't fucked, right? I'm pretty sure they haven't, but...</i>)",,"False",
"natsuki",9,"masturbating","totalFinished=0,totalMasturbating=1,alsoPlaying=sayori,priority=0","upset","Sayori, don't m-make me do this alone.",,"False",
"natsuki",9,"masturbating","totalFinished=0,totalMasturbating=1,alsoPlaying=sayori,priority=0","upset","Don't leave me hanging here, Sayori...",,"False",
"natsuki",9,"heavy_masturbating","notSaidMarker=nat_back_mast,alsoPlayingStage=7,alsoPlaying=sayori,alsoPlayingTimeInStage=0","upset","Okay, I'm back. (<i>I can't believe I walked out into the main room like this...</i>)","nat_back_mast","False",7
"natsuki",10,"finished_masturbating","notSaidMarker=nat_back_mast,alsoPlayingStage=7,alsoPlaying=sayori,alsoPlayingTimeInStage=0","upset","Okay, I'm back. (<i>I can't believe I walked out into the main room like this...</i>)","nat_back_mast","False",7
"natsuki",10,"finished_masturbating","alsoPlaying=sayori,alsoPlayingStage=-9,priority=0","laugh","I guess we both suck at this, huh Sayori?",,"False",-9
"natsuki",10,"finished_masturbating","timeInStage=0,alsoPlaying=sayori","fear","Ah! S-sayori! I--I'm sorry! I didn't mean...",,"False",
"natsuki",10,"finished_masturbating","timeInStage=0,alsoPlaying=sayori","fear","Nn!! S-sayori! I'm sorry, I... Um. I wasn't...",,"False",
"natsuki",10,"game_over_defeat","target=sayori","zsleep1","W-what? Sayori..? Oh... I <i>must</i> be dreaming... Zzzzzzzz...",,"False",
"natsuki",0,"selected","alsoPlaying=sayori,tag:monika=1","woah","Time for the club meeting... Wait, where's Yuri? Sh-she's not <i>sick</i> again, is she? M-maybe we should call her...",,"False",
"natsuki",0,"selected","alsoPlaying=sayori","happy","Hiiii Sayori! Are you and ~player~ ready for the club meeting?",,"False",
"natsuki",0,"female_must_strip","targetStage=0,target=sayori","mad","Hey! Chill off with the ""strip strip"" talk! Sayori doesn't owe you people anything!",,"False",0
"natsuki",0,"female_must_strip","targetStage=0,target=sayori","mad","Nn! Back off! Sayori doesn't have to strip if she doesn't want to! In fact, we can leave at any time, so zip it!!",,"False",0
"natsuki",0,"good_hand","totalRounds=0,alsoPlaying=sayori,priority=702","upset","It's not <i>strip</i> poker, Sayori. Get your head out of the gutter.",,"False",
"natsuki",0,"okay_hand","totalRounds=0,alsoPlaying=sayori,priority=702","upset","It's not <i>strip</i> poker, Sayori. Get your head out of the gutter.",,"False",
"natsuki",0,"bad_hand","alsoPlaying=sayori,totalRounds=0,priority=702","upset","It's not <i>strip</i> poker, Sayori. Get your head out of the gutter.",,"False",
"natsuki",0,"must_strip_normal","alsoPlaying=sayori,alsoPlayingStage=1-9","upset","W-well, I guess if Sayori's done it, I kinda have to...",,"False","1-9"
"natsuki",0,"must_strip_normal","alsoPlaying=sayori,alsoPlayingStage=1-9","upset","Jeez, Sayori... You're kinda painting me into a corner here. What else can I do but join in when you've already...",,"False","1-9"
"natsuki",0,"must_strip_normal","alsoPlaying=sayori,alsoPlayingStage=1-9","upset","I don't want to, b-but if Sayori already has...",,"False","1-9"
"natsuki",0,"must_strip_normal","totalRounds=0,alsoPlaying=sayori","fear","W-wait.. It <i>is</i> strip poker!?!? Y-you can't be serious, right??",,"False",
"natsuki",0,"must_strip_normal","totalRounds=0,alsoPlaying=sayori","fear","S-Sayori, why are you looking at me like that? This really <i>is</i> strip poker??",,"False",
"natsuki",0,"must_strip_normal","totalRounds=0,alsoPlaying=sayori","fear","Um. W-wait. Sayori, wh-when you said it was strip poker, you... You weren't joking??",,"False",
"natsuki",0,"must_strip_losing","totalRounds=0,alsoPlaying=sayori","fear","W-wait.. It <i>is</i> strip poker!?!? Y-you can't be serious, right??",,"False",
"natsuki",0,"must_strip_losing","totalRounds=0,alsoPlaying=sayori","fear","S-Sayori, why are you looking at me like that? This really <i>is</i> strip poker??",,"False",
"natsuki",0,"must_strip_losing","totalRounds=0,alsoPlaying=sayori","fear","Um. W-wait. Sayori, wh-when you said it was strip poker, you... You weren't joking??",,"False",
"natsuki",0,"stripping","alsoPlayingStage=0-3,alsoPlaying=sayori","zstripping","It's not fun, it's humiliating! I'm only doing this because next round I get to humiliate one of you!",,"False","0-3"
"natsuki",0,"stripping","alsoPlayingStage=0-3,alsoPlaying=sayori","zstripping","Who'd have fun <i>losing</i>? I'll tell you what's really fun: revenge.",,"False","0-3"
"natsuki",0,"stripping","alsoPlaying=sayori,alsoPlayingStage=8-9","zstripping","If Sayori is already... I guess it would be mean or something to not do my socks too.",,"False","8-9"
"natsuki",0,"must_strip_winning","alsoPlaying=sayori,alsoPlayingStage=1-9","upset","W-well, I guess if Sayori's done it, I kinda have to...",,"False","1-9"
"natsuki",0,"must_strip_winning","alsoPlaying=sayori,alsoPlayingStage=1-9","upset","Jeez, Sayori... You're kinda painting me into a corner here. What else can I do but join in when you've already...",,"False","1-9"
"natsuki",0,"must_strip_winning","alsoPlaying=sayori,alsoPlayingStage=1-9","upset","I don't want to, b-but if Sayori already has...",,"False","1-9"
"natsuki",0,"must_strip_winning","totalRounds=0,alsoPlaying=sayori","fear","W-wait.. It <i>is</i> strip poker!?!? Y-you can't be serious, right??",,"False",
"natsuki",0,"must_strip_winning","totalRounds=0,alsoPlaying=sayori","fear","S-Sayori, why are you looking at me like that? This really <i>is</i> strip poker??",,"False",
"natsuki",0,"must_strip_winning","totalRounds=0,alsoPlaying=sayori","fear","Um. W-wait. Sayori, wh-when you said it was strip poker, you... You weren't joking??",,"False",
"natsuki","0-10","female_must_strip","alsoPlayingSaidMarker=affections-glitch,targetStage=4,target=monika,alsoPlaying=sayori","smug","As if we haven't seen them twice already. (<i>It's almost as if Sayori's...</i>)",,"False",
"natsuki","0-10","female_must_strip","alsoPlayingSaidMarker=affections-glitch,target=monika,targetStage=5,alsoPlaying=sayori","aroused","(<i>Okay, so Monika's fixing to take of some underwear. How's Sayori going to react??</i>)",,"False",
"natsuki","0-10","female_must_strip","alsoPlayingSaidMarker=affections-glitch,target=monika,targetStage=7,alsoPlaying=sayori","calm","(<i>So Monika seems a bit cold. As normal.</i>)",,"False",
"natsuki","0-10","female_must_strip","targetStage=2,target=sayori","woah","Shirt? But you still-- O-oh yeah! You're shirt! Totally!",,"False",2
"natsuki","0-10","female_must_strip","targetStage=2,target=sayori","woah","Your shirt? But... Oh! Oh, yeah, it's totally time for your shirt!",,"False",2
"natsuki","0-10","female_must_strip","targetStage=3,target=sayori","donotwant","(<i>Don't be shy! You've got this, Sayori!</i>)",,"False",3
"natsuki","0-10","female_must_strip","targetStage=3,target=sayori","donotwant","(<i>Sayori! I'm rooting for you!</i>)",,"False",3
"natsuki","0-10","female_must_strip","targetStage=4,target=sayori","smug","What's it going to be, Sayori? Skirt, bra, or <i>panties</i>?",,"False",4
"natsuki","0-10","female_must_strip","targetStage=4,target=sayori","smug","Sayori again! You know Sayori, you totally could take of your bra or <i>panties</i> right now...",,"False",4
"natsuki","0-10","female_must_strip","targetStage=6,target=sayori","mad","Sayori! No complaining! No feeling sorry for yourself!! If you don't like it, then... Then just tell us to go fuck ourselves!!!!",,"False",6
"natsuki","0-10","female_must_strip","targetStage=6,target=sayori","mad","Sayori! Stop moping! You need to look out for your own happyness. A-and if we aren't helping, then tell us to fuck off!!!!",,"False",6
"natsuki","0-10","female_removing_minor","targetStage=0,alsoPlaying=sayori,filter=armor,notSaidMarker=say-armor,alsoPlayingSaidMarker=filter-armor","aroused","(<i>S-sayori, I think it's a sex thing. Like, cosplay-kink...</i>)","say-armor","False",
"natsuki","0-10","female_removing_minor","targetStage=0,alsoPlayingSaidMarker=filter-bald-1,alsoPlaying=sayori,notSaidMarker=say-bald1,filter=bald","laugh","Pft-- Hahahahah! S-sayori, you can't just say stuff like that!!","say-bald1","False",
"natsuki","0-10","female_removing_minor","targetStage=0,alsoPlaying=sayori,notSaidMarker=say-bald1,filter=bald,alsoPlayingSaidMarker=filter-bald-2","laugh","Pft-- Hahahahah! S-sayori, you can't just say stuff like that!!","say-bald1","False",
"natsuki","0-10","female_removing_minor","targetStage=0,alsoPlaying=sayori,alsoPlayingSaidMarker=filter-blue_hair-1,filter=blue_hair,notSaidMarker=say-blue1","happy","Not as blue as your eyes, Sayori. I'm so jealous!","say-blue1","False",
"natsuki","0-10","female_removing_minor","targetStage=0,alsoPlaying=sayori,alsoPlayingSaidMarker=filter-blue_hair-2,notSaidMarker=say-blue2,filter=blue_hair","happy","You really do like blue, huh Sayori? I should get you a blue bow. Oh, but it'll have to match your eyes...","say-blue2","False",
"natsuki","0-10","female_removing_minor","targetStage=0,alsoPlayingSaidMarker=filter-celebrity,filter=celebrity,alsoPlaying=sayori,notSaidMarker=say-celebrity","fear","(<i>S-sayori! It's ~name~! We're playing </i>strip poker<i> with the real ~name~!!</i>)","say-celebrity","False",
"natsuki","0-10","female_removing_minor","filter=cheerful,alsoPlaying=sayori,notSaidMarker=say-cheerful,alsoPlayingSaidMarker=filter-cheerful,alsoPlayingStage=0-7","happy","It's nice seeing Sayori looking so happy. (<i>I worry about her sometimes...</i>)","say-cheerful","False","0-7"
"natsuki","0-10","female_removing_minor","alsoPlayingSaidMarker=filter-fancy,alsoPlaying=sayori,notSaidMarker=say-fancy,filter=fancy,alsoPlayingStage=0-7","happy","We might be a little underdressed, huh Sayori?","say-fancy","False","0-7"
"natsuki","0-10","female_removing_minor","notSaidMarker=say-formal_attire,targetStage=0,alsoPlaying=sayori,filter=formal_attire,alsoPlayingSaidMarker=filter-formal_attire","happy","That outfit's pretty cool though, right? Sayori, I think even <i>you</i> would look cool dressed like that!","say-formal_attire","False",
"natsuki","0-10","female_removing_minor","targetStage=0,notSaidMarker=say-masked,alsoPlaying=sayori,alsoPlayingSaidMarker=filter-masked,filter=masked","mad","Hey, ~name~! Take off that mask! You're weirding out Sayori!","say-masked","False",
"natsuki","0-10","female_removing_minor","targetStage=2,target=sayori","upset","Oh, your shoes, huh? (<i>She totally chickened out...</i>)",,"False",2
"natsuki","0-10","female_removing_minor","targetStage=2,target=sayori","upset","Wait, shoes? But... (<i>Come on, Sayori. You have to be bold.</i>)",,"False",2
"natsuki","0-10","female_removed_major","alsoPlayingSaidMarker=monika-absent-2,notSaidMarker=say-monika-absent2,alsoPlayingStage=0-7,alsoPlaying=sayori","smug","Monika wouldn't ever <i>play</i> strip poker. That's totally out of character!","say-monika-absent2","False","0-7"
"natsuki","0-10","female_removed_major","filter=aggressive,alsoPlayingStage=0-7,notSaidMarker=say-aggressive,alsoPlaying=sayori,alsoPlayingSaidMarker=filter-aggressive","embarrassed","I-if ~name~ does anything to you Sayori, I'll... ~player~ and I will beat them up.","say-aggressive","False","0-7"
"natsuki","0-10","female_removed_major","filter=alien,alsoPlayingStage=0-7,notSaidMarker=say-alien,alsoPlaying=sayori,alsoPlayingSaidMarker=filter-alien","calm","You're right Sayori. That's a great cosplay.","say-alien","False","0-7"
"natsuki","0-10","female_removed_major","notSaidMarker=say-athletic,alsoPlayingSaidMarker=filter-athletic,alsoPlayingStage=0-7,filter=athletic,alsoPlaying=sayori","happy","Good thing this isn't some sort of sport, or we'd be toast, huh Sayori?","say-athletic","False","0-7"
"natsuki","0-10","female_removed_major","filter=drill_hair,alsoPlayingSaidMarker=filter-drill_hair-1,alsoPlayingStage=0-7,alsoPlaying=sayori,notSaidMarker=say-drill_hair1","smug","I keep telling you, Sayori. Fashion's <i>worth</i> the effort.","say-drill_hair1","False","0-7"
"natsuki","0-10","female_removed_major","notSaidMarker=say-drill_hair2,filter=drill_hair,alsoPlayingStage=0-7,alsoPlaying=sayori,alsoPlayingSaidMarker=filter-drill_hair-2","laugh","Sayori with drill hair? That would be a riot.","say-drill_hair2","False","0-7"
"natsuki","0-10","female_removed_major","alsoPlayingSaidMarker=affections-glitch,targetStage=4,target=monika,alsoPlaying=sayori","mad","Sayori? What's wrong?? Sayori?",,"False",
"natsuki","0-10","female_removed_major","alsoPlayingSaidMarker=affections-glitch,target=monika,targetStage=5,alsoPlaying=sayori","isthatapenis","(<i>Whatthefuck whatthefuck whatthefuck whatthefuck!!!!</i>)",,"False",
"natsuki","0-10","female_removed_major","targetStage=4,target=sayori","happy","Eeeeee!! (<i>Sayori, ~player~'s looking!!</i>)",,"False",4
"natsuki","0-10","female_removed_major","targetStage=4,target=sayori","happy","Heeheehee!! (<i>Look, Sayori! ~player~'s totally into it!</i>)",,"False",4
"natsuki","0-10","female_removed_major","targetStage=5,target=sayori","upset","(<i>Oh, she's... Not happy.</i>)",,"False",5
"natsuki","0-10","female_crotch_will_be_visible","alsoPlayingSaidMarker=affections-glitch,alsoPlaying=sayori,target=monika","tsun","(<i>Oh! Monika's coldness must have hurt Sayori's feelings! D-don't gloat, Monika! Sayori deserves better!</i>)",,"False",
"natsuki","0-10","female_crotch_will_be_visible","targetStage=6,target=sayori","zblank","I need a minute! Don't start the next hand without me!",,"False",6
"natsuki","0-10","female_crotch_will_be_visible","targetStage=6,target=sayori","zblank","I need to cool off! J-just wait a minute, okay?",,"False",6
"natsuki","0-10","male_removed_minor","alsoPlayingSaidMarker=cooking-lessons,alsoPlayingStage=0-5,notSaidMarker=say-cooking-lessons,alsoPlaying=sayori","tsun","Hmph. What does <i>~player~</i> know about cooking? He's a <i>boy</i>, remember?","say-cooking-lessons","False","0-5"
"natsuki","0-10","male_removed_minor","alsoPlayingStage=0-5,alsoPlayingSaidMarker=doors,notSaidMarker=say-doors,alsoPlaying=sayori","embarrassed","I woudn't wander if I were you, Sayori. Who knows what creeps there are in a place like this.","say-doors","False","0-5"
"natsuki","0-10","male_removed_minor","alsoPlayingStage=0-5,notSaidMarker=say-origami-swans,alsoPlayingSaidMarker=origami-swans,alsoPlaying=sayori","laugh","O-origami?? Sayori, you ditz! Get your head in the game, girl!","say-origami-swans","False","0-5"
"natsuki","0-10","male_removed_minor","alsoPlayingSaidMarker=sisyphus,notSaidMarker=say-sisyphus,alsoPlayingStage=0-5,alsoPlaying=sayori","upset","Sayori, is this really the time to be asking about Yuri's horror novels?","say-sisyphus","False","0-5"
"natsuki","0-10","male_removed_minor","alsoPlayingStage=0-5,alsoPlayingSaidMarker=sphinx-riddle,notSaidMarker=say-sphinx-riddle,alsoPlaying=sayori","upset","Sayori, that was in Oedipus. We read it last month? World lit class? The Sphinx?","say-sphinx-riddle","False","0-5"
"natsuki","0-10","male_removed_minor","alsoPlayingStage=0-5,notSaidMarker=say-what-is-inventory,alsoPlaying=sayori,alsoPlayingSaidMarker=what-is-inventory","calm","This place is a bar, right? A really weird bar with a pool and public bath and arcade...","say-what-is-inventory","False","0-5"
"natsuki","0-10","male_removed_minor","alsoPlayingStage=0-5,notSaidMarker=say-where-are-we,alsoPlayingSaidMarker=where-are-we,alsoPlaying=sayori","fear","W-wait. Sayori, you don't know where we are either?","say-where-are-we","False","0-5"
